Ballot ID,Full Council District,CounDist,CounPerson,Category,location_type,name,Cost,description,Location,lat,lon,Notes,shortlisted
0150,"District 22, Costa Constantinides",22,Costa Constantinides,Education,education,Auditorium Upgrade,"$490,000","A comprehensive upgrade to the Long Island City High School auditorium including new seats, stage lighting, stage curtains, and audiovisual equipment","14-30 Broadway, Long Island City",40.765673,-73.932893,,TRUE
0151,"District 22, Costa Constantinides",22,Costa Constantinides,Education,education,New SMART Boards,"$150,000",Provide Long Island City High School with  25 new SMART Boards for teachers to use during instruction inside classrooms,"14-30 Broadway, Long Island City",40.765773,-73.932893,,TRUE
0152,"District 22, Costa Constantinides",22,Costa Constantinides,Education,education,Bathroom Upgrades,"$400,000",Provide necessary upgrades to the bathrooms at Long Island City High School,"14-30 Broadway, Long Island City",40.765573, -73.932993,,TRUE
0153,"District 22, Costa Constantinides",22,Costa Constantinides,Education,education,Junior H.S. Tech Upgrades District Wide ,"$175,000","New technology equipment at all of the junior high schools (IS 141, IS 235, IS 10, IS 126, and Young Women’s Leadership Academy) in the district including new computers, printers, or laptops",District- Wide (See Description),40.766877, -73.922766,Used the coordinates for IS 235,TRUE
0154,"District 22, Costa Constantinides",22,Costa Constantinides,Education,education,Playground Upgrade,"$400,000",Update play equipment at P.S. 171.,14-14 29th Ave. Astoria,40.770934, -73.929017,,TRUE
0155,"District 22, Costa Constantinides",22,Costa Constantinides,Education,education,Playground Upgrade,"$400,000",Update play equipment at P.S. 2.,75-10 21st Ave. E. Elmhurst,40.770124, -73.894100,,TRUE
0156,"District 22, Costa Constantinides",22,Costa Constantinides,Education,education,Bathroom Upgrade,"$455,000",Update student bathrooms at P.S. 122.,21-21 Ditmars Blvd. Astoria,40.780414,-73.915819,,TRUE
0157,"District 22, Costa Constantinides",22,Costa Constantinides,Education,education,P.S. 122 Cafeteria Noise Pollution Mitigation,"$250,000","Installing soundproofing and other updates to mitigate noise pollution in the cafeteria, which is also used for afterschool activities and special events. This will lessen health risks for children.",21-21 Ditmars Blvd. Astoria,40.780314, -73.915919,,TRUE
0158,"District 22, Costa Constantinides",22,Costa Constantinides,"Arts, Culture & Community Facilities",culture,Cyber Center Infrastructure Upgrade,"$500,000",Upgrade Astoria Library’s cyber center for fast and effective internet access anywhere in the library.,14-01 Astoria Blvd. Astoria,40.772535,-73.928843,,TRUE
0159,"District 22, Costa Constantinides",22,Costa Constantinides,"Arts, Culture & Community Facilities",culture,Children's Room Shelving Upgrade,"$35,000",Install new shelving units to Astoria Library for children's books.,14-01 Astoria Blvd. Astoria,40.772335,-73.928643,,TRUE
0160,"District 22, Costa Constantinides",22,Costa Constantinides,"Arts, Culture & Community Facilities",culture,Basement Program Room Upgrade,"$50,000",The current program room in Astoria Library is suffering from structural issues (like water damage) which need repair.,14-01 Astoria Blvd. Astoria,40.772435, -73.928743,,TRUE
0161,"District 22, Costa Constantinides",22,Costa Constantinides,Housing,housing,Astoria Houses Basketball Court Lighting Upgrade,"$500,000",The lighting at the basketball court is very poor and in need of an upgrade.,4-20 Astoria Blvd. Astoria,40.772572, -73.933225,,TRUE
0162,"District 22, Costa Constantinides",22,Costa Constantinides,Parks & Recreation,parks,Fitness Upgrade: Whitey Ford Field ,"$300,000","Upgrade the fitness equipment, which will enhance the public health benefits of the neighborhood.",26th Ave. & 2nd St. Astoria,40.777759, -73.934223,,TRUE
0163,"District 22, Costa Constantinides",22,Costa Constantinides,Parks & Recreation,parks,Picnic and Gaming Tables Installation,"$250,000",Place permanent gaming/picnic tables in Astoria Park at locations to be determined by the community.,Astoria Park,40.779906,-73.921313,,TRUE
0164,"District 22, Costa Constantinides",22,Costa Constantinides,Parks & Recreation,parks,Water Fountain Project,"$500,000",Repair or install new water fountains in Astoria Park.,Astoria Park,40.779706,-73.921113,,TRUE
0165,"District 22, Costa Constantinides",22,Costa Constantinides,Parks & Recreation,parks,Senior Pool Area Improvements,"$300,000","Install new safety equipment, including new ladders and railings, in the senior pool area in Astoria Park.",Astoria Park,40.779806, -73.921213,,TRUE
0166,"District 22, Costa Constantinides",22,Costa Constantinides,Parks & Recreation,parks,Fitness Upgrade: Bulova Park,"$250,000","Upgrade the fitness equipment, which will enhance the public health benefits of the neighborhood.",25th Ave. & 76th St. East Elmhurst,40.7635,-73.892261,,TRUE
0167,"District 22, Costa Constantinides",22,Costa Constantinides,Parks & Recreation,parks,Handball Courts: Bulova Park,"$150,000",Repair the handball courts in Bulova Park.,25th Ave. & 76th St. East Elmhurst,40.763400, -73.892161,,TRUE
0168,"District 22, Costa Constantinides",22,Costa Constantinides,Transit,transit,Real Time Bus Countdown Clocks,"$480,000","Install 24 countdown clocks ($20,000 each) on the following bus lines: M60, Q18, Q19, Q33, Q47, Q69, Q101, Q102, Q103, and Q104 (if project wins, locations TBD by members of the community)",Multiple Locations,40.765221, -73.888990,Chose a stop on the Q47,TRUE
0169,"District 23, Barry Grodenchik",23,Barry Grodenchik,"Arts, Culture & Community Facilities",culture,Upgrades at Hollis and Queens Village Libraries,"$550,000","Facility upgrades, technology installations, and library materials.",Hollis Library & Queens Village Library ,40.720177, -73.762005,Chose the Hollis Library coordinates ,TRUE
0170,"District 23, Barry Grodenchik",23,Barry Grodenchik,Parks & Recreation,parks,Vanderbilt Motor Parkway Resurfacing,"$500,000","Resurfacing section of the motor parkway with full-depth asphalt perimeter, starting at eastern end near Winchester Boulevard.",Vanderbilt Motor Parkway,40.739085, -73.733939,,TRUE
0171,"District 23, Barry Grodenchik",23,Barry Grodenchik,Education,education,New Audio Visual Systems ,"$375,000",New audio visual systems including all necessary technology and auxiliary items.,"P.S. 18Q, 26Q, 33Q, 186Q, and I.S. 109Q",40.732099, -73.731998,Chose PS 18Q for coordinates ,TRUE
0172,"District 23, Barry Grodenchik",23,Barry Grodenchik,Education,education,Technology Upgrades for Local Schools,"$548,000","Laptop carts and smart boards at P.S. 33Q, 178Q, I.S. 109Q, Queens High School of Teaching, Business Technology Early College High School, and P224Q at PS 205Q and P.S. /I.S. 266Q.",Individual Schools are Listed in Description,40.727141, -73.733860,Chose PS 33Q coordinates ,TRUE
0173,"District 23, Barry Grodenchik",23,Barry Grodenchik,Education,education,New Gym Floor for Martin Van Buren High School ,"$100,000",Replacement of gym floor in Martin Van Buren High School.,"230-17 Hillside Avenue, Queens Village ",40.733702, -73.739001,,TRUE
0174,"District 26, Jimmy Van Bramer",26,Jimmy Van Bramer,Education,education,Special Needs Playground for P4 at Skillman,"$250,000","Install safety surfacing and customized playground equipment that would target the needs of children with autism spectrum disorders grades K-8. This includes ramps, slides, game boards & monkey bars.",24-30 Skillman Ave. (Long Island City),40.742204, -73.945155,,TRUE
0175,"District 26, Jimmy Van Bramer",26,Jimmy Van Bramer,Education,education,Queens Atrium Educational Hub - Wi-fi Network,"$75,000","Add Internet bandwidth and deploy Wi-Fi hardware for the use of students, faculty and staff at the three public high schools in the Queens Atrium Building, an education hub. ",30-20 Thomson Ave. (Long Island City),40.744868, -73.936894,,TRUE
0176,"District 26, Jimmy Van Bramer",26,Jimmy Van Bramer,Education,education,Auditorium Repairs for Aviation High School ,"$450,000",Purchase new stage curtains and lighting for the auditorium at Aviation High School. ,45-30 36th St. (Sunnyside),40.743946, -73.929044,,TRUE
0177,"District 26, Jimmy Van Bramer",26,Jimmy Van Bramer,Education,education,Tech Upgrades PS 150 & Academy of American Studies,"$210,000",Each school will receive six laptop carts with 30 laptops each. Access to computers in the classroom will help to enhance instruction and allow students greater learning opportunities.,P.S. 150 and Academy of American Studies,40.745755, -73.923394,Chose coordinates for PS 150,TRUE
0178,"District 26, Jimmy Van Bramer",26,Jimmy Van Bramer,Education,education,Auditorium Upgrade for P.S. 166 ,"$300,000","The school is need of nine window curtains, front and back curtains on stage, soundproofing on the ceiling, stage lighting, stage floor, auditorium flooring, piano, paint and wiring for AC. ",33-09 35th Avenue (Long Island City),40.757376, -73.926272,,TRUE
0179,"District 26, Jimmy Van Bramer",26,Jimmy Van Bramer,Education,education,Split System (AC) for I.S. 204 & Energy Tech H.S.,"$350,000","Sharing space with Energy Tech High School, I.S. 204 is a community school, open year round for various activities.  The auditorium is in need of cooling for use during the summer months. ", I.S. 204 and Energy Tech H.S.,40.75653,-73.932722,Chose coordinates for HS,TRUE
0180,"District 26, Jimmy Van Bramer",26,Jimmy Van Bramer,Education,education,Auditorium Upgrade for I.S. 204 & Energy Tech H.S.,"$200,000","The auditorium is need of lighting upgrades, microphone system and audio equipment. ", I.S. 204 and Energy Tech H.S.,40.756430, -73.932622,Chose coordinates for HS,TRUE
0181,"District 26, Jimmy Van Bramer",26,Jimmy Van Bramer,Education,education,Auditorium Seating for P.S. 111,"$100,000","The auditorium is separated into three sections. The seats in the two side sections have been replaced, but the third (middle) still needs to be done. ",37-15 13th Street (Long Island City),40.758625, -73.939228,,TRUE
0182,"District 26, Jimmy Van Bramer",26,Jimmy Van Bramer,"Arts, Culture & Community Facilities",culture,Court Square Library Security System Upgrade,"$66,000",Installation of security system including CCTV cameras and associated equipment.,25-01 Jackson Avenue (Long Island City),40.747267, -73.944407,,TRUE
0183,"District 26, Jimmy Van Bramer",26,Jimmy Van Bramer,"Arts, Culture & Community Facilities",culture,Broadway Library Security System Upgrade ,"$132,000",Installation of security system including CCTV cameras and associated equipment.  ,42-20 Broadway (Astoria),40.758494, -73.918515,,TRUE
0184,"District 26, Jimmy Van Bramer",26,Jimmy Van Bramer,Parks & Recreation,parks,Renovation of Dutch Kills Playground,"$300,000",Renovation of the playground to include adult fitness equipment and adaptive swings.,28th Street (Dutch Kills) ,40.757171, -73.933114,,TRUE
0185,"District 26, Jimmy Van Bramer",26,Jimmy Van Bramer,Parks & Recreation,parks,Hunter’s Point South Park Playground Canopy,"$500,000",Installation of a fixed structure close to the existing children's playground that will provide shade on sunny days.  ,Center Boulevard (Long Island City) ,40.743243, -73.960606,,TRUE
0186,"District 26, Jimmy Van Bramer",26,Jimmy Van Bramer,Parks & Recreation,parks,Median Tree Planting,"$100,000",Trees and other greenery planted on the traffic median in Long Island City.  ,48th Avenue btw 5th St. & Vernon Blvd. ,40.744340, -73.954753,Chose a coordinate along 48th Avenue ,TRUE
0187,"District 26, Jimmy Van Bramer",26,Jimmy Van Bramer,Parks & Recreation,parks,BBQ Area Picnic Tables ,"$300,000",BBQ areas and facilities with picnic tables and benches.,"Rainy Park: Vernon Blvd, 33rd Rd & 34th Ave.",40.766108, -73.940696,,TRUE
0188,"District 26, Jimmy Van Bramer",26,Jimmy Van Bramer,Transit,transit,Dutch Kills Pedestrian Safety ,"$300,000","Installation of bus bulbs on 31st St. at 36th Ave & 39th Ave. Project will construct full bus bulbs at these bus stops, which will create a seamless path from the sidewalk & subway station entrance. ",Dutch Kills ,40.755923, -73.930244,Chose a coordinate along 31st Street ,TRUE
0189,"District 26, Jimmy Van Bramer",26,Jimmy Van Bramer,Housing,housing,Basketball Court Renovations ,"$350,000 per court ",Replacement of three courts concrete slab will be installed. Three-quarter-inch thick plastic polymer tile that provides a floating surface to help drain water and prevent the concrete from cracking. ,Ravenswood and Queensbridge Houses ,40.761964,-73.934493,Chose coordinates for Ravenswood Houses,TRUE
0190,"District 26, Jimmy Van Bramer",26,Jimmy Van Bramer,Housing,housing,Grounds Renovation for Queensbridge Houses,"$300,000","Replacing asphalt, fencing and greening to beautify areas within the development. (designed to budget). ",Queensbridge Houses,40.755228, -73.945405,,TRUE
0191,"District 26, Jimmy Van Bramer",26,Jimmy Van Bramer,Housing,housing,Grounds Renovation for Woodside Houses,"$300,000","Replacing asphalt, fencing and greening to beautify areas within the development. (designed to budget). ",Woodside Houses,40.750721, -73.900261,,TRUE
0192,"District 26, Jimmy Van Bramer",26,Jimmy Van Bramer,Housing,housing,Grounds Renovations for Ravenswood Houses,"$300,000","Replacing asphalt, fencing and greening to beautify areas within the development. (designed to budget). ",Ravenswood Houses,40.761864, -73.934393,,TRUE
0193,"District 27, I. Daneek Miller",27,I. Daneek Miller,Education,education,School Auditorium Multimedia Upgrade,"$100,000",The project will provide a new sound and projection system for the school auditorium.,"P.S. 15, 121-15 Lucas Street, St. Albans",40.686003, -73.756735,,TRUE
0194,"District 27, I. Daneek Miller",27,I. Daneek Miller,Education,education,"Conversion of School Auditorium to a ""Gymnatorium""","$400,000",The project will renovate the current auditorium to provide space for students to have indoor physical education space ,"P.S. 36, 187-01 Foch Blvd, St. Albans",40.713449, -73.767465,,TRUE
0195,"District 27, I. Daneek Miller",27,I. Daneek Miller,Education,education,STEM/ STEAM Mobile Science Carts for Eight Schools,"$294,000","This project will provide mobile labs to Humanities & Arts HS, Math, Science, Research & Technology HS, Institute for Health Professions HS, PS/IS 116, Pathways College Prep, IS 192, IS 8, and IS 238",Eight Schools in District 27,40.700652, -73.781678,Chose the coordinates for PS/IS 116,TRUE
0196,"District 27, I. Daneek Miller",27,I. Daneek Miller,Education,education,Adaptive Special Needs Playground Equipment,"$600,000",This project would install playgrounds with special adaptive equipment for General Education and District 75 students at two locations serving four schools in total,P.S 136 & P.S/M.S 147,40.698594, -73.752435,Chose the coordinates for PS 136,TRUE
0197,"District 27, I. Daneek Miller",27,I. Daneek Miller,Streets,streets,Security Cameras in District 27,"$70,000",The project will fund two NYPD security cameras to provide safety for residents of the district.,St. Albans & Jamaica,40.691777, -73.777542,Locations are not set so we used the District Office location,TRUE
0198,"District 27, I. Daneek Miller",27,I. Daneek Miller,Youth,youth,Smartboards for I.S 238 - Susan B. Anthony Academy,"$125,000",The project would provide 20 smartboards for the school,"I.S. 238, 88-15 182 Street, Hollis",40.712909,-73.779921,,TRUE
0199,"District 27, I. Daneek Miller",27,I. Daneek Miller,Youth,youth,Tennis Court at I.S 238 - Susan B. Anthony Academy,"$250,000",The project would construct one tennis court in the school yard,"I.S. 238, 88-15 182 Street, Hollis",40.712809, -73.779821,,TRUE
0200,"District 27, I. Daneek Miller",27,I. Daneek Miller,Youth,youth,P.S. 15 Gymnasium Upgrade,"$150,000","This project would resurface the gym floor, provide new basketball hoops, and improve the lighting, bleachers and scoreboard","121-15 Lucas Street, Springfield Gardens",40.685908, -73.756956,,TRUE
0201,"District 27, I. Daneek Miller",27,I. Daneek Miller,Youth,youth,P.S./M.S. 147 Gymnasium Upgrade,"$150,000","This project would resurface the gym floor, provide new basketball hoops, improve the lighting, bleachers and scoreboard","P.S/M.S 147, 218-01 116 Avenue, Cambria Heights",40.698127,-73.740217,,TRUE
0202,"District 27, I. Daneek Miller",27,I. Daneek Miller,Youth,youth,Technology Upgrades for P.S./M.S. 147,"$70,000",Laptops and laptop carts for P.S./M.S. 147.,"218-01 116 Avenue, Cambria Heights",40.698127,-73.740017,,TRUE
0203,"District 27, I. Daneek Miller",27,I. Daneek Miller,Youth,youth,Student Bathroom Renovations at I.S. 192,"$400,000",The project would renovate eight student bathrooms in the school,"I.S. 192, 109-89 204 Street, St. Albans",40.705704, -73.752671,,TRUE
0204,"District 27, I. Daneek Miller",27,I. Daneek Miller,Youth,youth,New Laptops for Five Schools ,"$225,000","The project will provide 250 laptops to five schools in the district: P.S. 36, P.S. 176, P.S./M.S. 147, I.S. 192, Pathways College Preparatory School",Five Schools in the District,40.698027, -73.740117,Chose the coordinates for PS/MS 147,TRUE
0205,"District 27, I. Daneek Miller",27,I. Daneek Miller,Parks & Recreation,parks,Haggerty Park Greenery,"$300,000",This project will remove tree stumps and plant new trees in the park,"Jamaica Avenue, between 201 St. & 204 St.",40.713453, -73.758020,"No address found, go by coordinates I chose",TRUE
0206,"District 29, Karen Koslowitz",29,Karen Koslowitz,Transit,transit,Bus Trackers,"$160,000",This project will implement electronic countdown clocks indicating when the next bus will arrive at multiple bus stops in the district. ,"Q60, Q64, Q23, and Q46 (District- Wide) ",40.732328, -73.867996,Chose a stop on the Q60,TRUE
0207,"District 29, Karen Koslowitz",29,Karen Koslowitz,Transit,transit,Bus Pads,"$320,00 to $520,00",Bus Pads are the concrete pavement at bus stops. New bus pads will promote safety & accessibility for a variety of bus riders at the Q23 stops at Queens Blvd and 71st Avenue. ,Locations to be Verified by DOT. ,40.721263, -73.844273,,TRUE
0208,"District 29, Karen Koslowitz",29,Karen Koslowitz,Education,education,Proper Pupil Potties,"$350,000",The complete renovation of select bathrooms at three public schools which are a persistent problem. This will reduce the amount of time and money used to maintain the aging bathrooms.,"P.S. 144, P.S. 174, and P.S. 101",40.715188, -73.853200,Chose coordinates for PS 144,TRUE
0209,"District 29, Karen Koslowitz",29,Karen Koslowitz,Education,education,"Lights, Camera, Action","$300,000",Audio Video upgrades for each auditorium in four public schools. The audio video systems are old and broken. This project will address the out dated technology in the auditoriums within our schools.,"P.S. 139, P.S. 174, P.S. 175, and J.H.S. 157",40.720582, -73.861435,Chose coordinates for PS 174,TRUE
0210,"District 29, Karen Koslowitz",29,Karen Koslowitz,Education,education,More Cool at School,"$800,000",This project will fund wiring to install air conditioning systems in common areas like cafeterias and auditoriums. Large sections of these schools cannot be used comfortably during spring and summer.,"P.S. 196Q, J.H.S. 157, and P.S. 174",40.722993, -73.837702,Chose coordinates for PS 196,TRUE
0211,"District 29, Karen Koslowitz",29,Karen Koslowitz,Education,education,Power Up,"$550,000",Providing new computers for three schools that have outdated desktops and not enough laptops to service the students. Having new computers will educate and enhance the student's abilities.,"P.S. 99, P.S. 139, and J.H.S. 157",40.711560, -73.827857,Chose coordinates for PS 99,TRUE
0212,"District 29, Karen Koslowitz",29,Karen Koslowitz,Parks & Recreation,parks,Adult Workout Stations in Russell Sage Playground,"$250,000","Installing fitness equipment that can be utilized by individuals or small groups. The equipment will be placed at easily accessible areas, making it hassle free to exercise.",Booth St. Btw 68 Ave. & 68 Dr.,40.724378, -73.851320,,TRUE
0213,"District 29, Karen Koslowitz",29,Karen Koslowitz,Streets,streets,A Safer Intersection at 71st Ave and Austin St,"$400,000",Installing a single curb extension at the Northeast corner of 71st Avenue and Austin Street. This would help calm traffic along both streets and improve safety for pedestrians on those streets.,71st Avenue and Austin Street,40.720132, -73.844765,,TRUE
0214,"District 29, Karen Koslowitz",29,Karen Koslowitz,"Arts, Culture & Community Facilities",culture,Outdoor Reading Room,"$275,000",Utilize outdoor space for a reading room and renovate the meeting room in the library. This would add reading space in a natural environment that will encourage returning visits and customer usage.,Forest Hills Library,40.722101, -73.842987,,TRUE
0215,"District 30, Elizabeth Crowley",30,Elizabeth Crowley,Parks & Recreation,parks,Children's Swing Area Renovation ,"$200,000","Renovating the children’s swing area to make it a safer environment. The children’s swing sets need new metal bars, a new safety surface installation and fencing repairs.",Reiff & Nathan Weidenbaum Playgrounds,40.718730, -73.901317,,TRUE
0216,"District 30, Elizabeth Crowley",30,Elizabeth Crowley,Parks & Recreation,parks,Basketball Court Renovations at Little Bush Park ,"$250,000","Renovate the basketball courts for better usage and safety! This includes new backboards, basketball hoops, a sports coating and a new fence to enclose it.",Nathan Weidenbaum (Little Bush) Playground,40.738317,-73.902356,,TRUE
0217,"District 30, Elizabeth Crowley",30,Elizabeth Crowley,Parks & Recreation,parks,Playground Beautification at Little Bush Park ,"$100,000",Horticultural renovations to beautify the playground and create a noise barrier between the playground and residential homes. ,Nathan Weidenbaum (Little Bush) Playground,40.738217, -73.902256,,TRUE
0218,"District 30, Elizabeth Crowley",30,Elizabeth Crowley,Education,education,Smart Boards for Schools ,"$250,000",Fifteen SMART Boards for each of the listed schools will allow for the integration of various technologies within the classroom to improve the learning experiences of students!,Grover Cleveland H.S & P.S/IS 87,40.711669, -73.909206,Chose coordinates from Cleveland HS ,TRUE
0219,"District 30, Elizabeth Crowley",30,Elizabeth Crowley,Education,education,Laptop Carts for Classrooms ,"$280,000",Providing laptop carts for schools to make the latest technology more accessible for students in the classroom!  ,"P.S/I.S 49, P.S 87, P.S/I.S 119, P.S 153 ",40.719543, -73.874953,Chose the coordinate for PS/IS 49,TRUE
0220,"District 30, Elizabeth Crowley",30,Elizabeth Crowley,Education,education,Air Conditioning Renovation at I.S. 73,"$350,000",Purchase and install a ductless split air conditioning system to cool the cafeteria or auditorium in the school building.,Maspeth ,40.728702, -73.893229,,TRUE
0221,"District 30, Elizabeth Crowley",30,Elizabeth Crowley,Education,education,Operation Restroom Renovation,"$385,000",Working and updating bathrooms are essential for the health and hygiene of the students. These renovations are to bathrooms which require and have not received recent repairs or renovations.,"P.S./I.S. 49, P.S. 09, P.S. 88",40.704054, -73.896524,Chose the coordinate for PS 88,TRUE
0222,"District 30, Elizabeth Crowley",30,Elizabeth Crowley,Education,education,Auditorium Seat Replacement ,"$786,750",Create a safer experience for students by replacing and repairing the auditorium seats in our schools. ,P.S. 71 and P.S. 153,40.711409, -73.904623,Chose the Coordinates for PS 71,TRUE
0223,"District 30, Elizabeth Crowley",30,Elizabeth Crowley,"Arts, Culture & Community Facilities",culture,"Computers, Equipment and Furniture","$36,000",Fulfilling a community need by adding more desktop computers along with equipment and furniture to the Ridgewood and Maspeth Public Libraries. ,Ridgewood Library & Maspeth Public Library,40.705173, -73.902529,Chose the coordinates for Ridgewood Library ,TRUE
0224,"District 31, Donovan Richards",31,Donovan Richards,Education,education,Far Rockaway High School Library Upgrade,"$250,000",The Far Rockaway High School library is very important to the school. It has resources that the students can rely on. But now the library is need of new computers and also an electrical upgrade.,"821 Bay 25th Street, Far Rockaway",40.602463,-73.763284,,TRUE
0225,"District 31, Donovan Richards",31,Donovan Richards,Education,education,M.S.53 Technology Upgrade,"$75,000",The school is in need of 6 new smart boards to further education for students.,10-45 Nameoke Street,40.603771,-73.749597,,TRUE
0226,"District 31, Donovan Richards",31,Donovan Richards,Education,education,P.S.106 Technology Upgrade,"$75,000",The school is in need of 6 new smart boards to further the education for students.,"180 Beach 35th St., Far Rockaway",40.594556,-73.766918,,TRUE
0227,"District 31, Donovan Richards",31,Donovan Richards,Education,education,Designing a Track in the School Yard,"$500,000",P.S.106 is in need of a track in the school yard. A track in the school yard would not only help beautify the school but also provide an activity that would promote an healthy lifestyle for the students.,"180 Beach 35th St., Far Rockaway",40.594756,-73.766918,,TRUE
0228,"District 31, Donovan Richards",31,Donovan Richards,Education,education,New Smart Boards,"$75,000",P.S. 253 is in need of six new smart boards to further education for students ,"1307 Central Avenue, Far Rockway",40.607380, -73.748840,,TRUE
