Ballot ID,Full Council District,CounDist,CounPerson,Category,location_type,name,Cost,description,Location,lat,lon,Notes,shortlisted
0001,"District 03, Corey Johnson",3,Corey Johnson,Parks & Recreation,parks,Grounds Renovation at Chelsea-Elliott Houses,"$500,000","Add new playground fencing, renovate walkways, and revitalize garden and grassy areas. Project would be designed to budget and priority areas would be determined in conjunction with the RA leadership.","425 West 25th Street, New York, NY 10001",40.748788, -74.001472,,TRUE
0002,"District 03, Corey Johnson",3,Corey Johnson,Parks & Recreation,parks,Repair/Reopen Staircase at DeWitt Clinton Park,"$500,000",The southwest entrance staircase is crumbling and has been closed for years. Repairing this entrance will make the park accessible to visitors and easier for children to enter the park on 12th Ave.,"West 52 Street and 11 Avenue, New York, NY 10019",40.768266, -73.993552,,TRUE
0003,"District 03, Corey Johnson",3,Corey Johnson,Parks & Recreation,parks,Renovation of Historic Field House,"$250,000",Restoration towards the Downing Street playground's historic field house and bathrooms to make them wheelchair accessible.,"1 Downing Street, New York, NY 10014",40.729745, -74.002362,,TRUE
0004,"District 03, Corey Johnson",3,Corey Johnson,Parks & Recreation,parks,New Fitness Equipment for Chelsea Park,"$180,000","New fitness units, including safety surfacing, seating and drinking fountains replacement.","West 27th Street and 10th Avenue, New York, NY 10001",40.750301,-74.000865,,TRUE
0005,"District 03, Corey Johnson",3,Corey Johnson,Education,education,New Audio / Visual System for P.S 11,"$75,000",A new Audio/Visual System in the auditorium of P.S. 11. The school needs a working A/V system to fulfill its curriculum requirements for students.,"320 West 21st Street, New York, NY 10011",40.744469, -74.000720,,TRUE
0006,"District 03, Corey Johnson",3,Corey Johnson,Education,education,"Bathroom Upgrade - Lab MS, Lab HS & Museum High","$560,000","Phase 2 renovations will make needed repairs to bathrooms on upper floors, addressing health and hygiene concerns for the school community.","333 West 17th Street, New York, NY 10011",40.742815,-74.002834,,TRUE
0007,"District 03, Corey Johnson",3,Corey Johnson,Education,education,"Gym Renovation - Lab M.S, Lab H.S.& Museum High","$300,000","Gym improvements with exploration to build more communal space will address broken bleachers, difficult to operate scoreboard, flooring to support aerobic activity, and create more educational space.","333 West 17th Street, New York, NY 10011",40.742715, -74.002734,,TRUE
0008,"District 03, Corey Johnson",3,Corey Johnson,Education,education,A New Library for City Knoll School ,"$300,000",Technological and construction updates to create a library space at City Knoll School. This project will help engage students and prepare them for the skills needed in the 21st century.,"425 West 33rd Street, New York, NY 10001",40.753608, -73.997925,,TRUE
0009,"District 03, Corey Johnson",3,Corey Johnson,Education,education,A Green Roof for 75 Morton School ,"$200,000",Build a green roof on the new middle school coming to 75 Morton Street. This would provide new physical and educational opportunities for students. ,"75 Morton Street, New York, NY 10014",40.731214, -74.007365,,TRUE
0010,"District 03, Corey Johnson",3,Corey Johnson,Transit,transit,Real Time Rider Information at Bus Stops,"$100,000","Electronic Boards to display real time bus arrival information at five key bus stops, offering convenience for riders. The proposed locations will be subject to feasibility analysis by DOT.",District Wide,40.74901,-73.993783,Locations are not set so we used the District Office location,TRUE
0011,"District 03, Corey Johnson",3,Corey Johnson,Transit,transit,More Turnstiles at C/E 50th Street Station,"$135,000",Install two additional turnstiles at the entrance/exit of the C/E 50th Street uptown platform. More turnstiles will ease congestion and reduce wait times for passengers at this entrance/exit.,C/E Subway Station at 50th Street and 8th Avenue,40.762458, -73.986019,,TRUE
0012,"District 03, Corey Johnson",3,Corey Johnson,"Arts, Culture & Community Facilities",culture,Cool Muhlenberg Library. Renovate HVAC System,"$500,000","Replace the building's HVAC cooling unit to ensure that the branch can continue to serve as a cool space in the summer months, which includes serving as an official NYC Cooling Center.","209 West 23rd Street, New York, NY 10011",40.744517, -73.995888,,TRUE
0013,"District 03, Corey Johnson",3,Corey Johnson,Youth,youth,Renovate the Basketball Court at Chelsea Park,"$350,000",The basketball court is a neighborhood favorite which needs to be improved for the safety and enjoyment of the community. This project would repave the court and install new rims.,"West 27th Street and 10th Avenue, New York, NY 10001",40.750201, -74.000765,,TRUE
0014,"District 03, Corey Johnson",3,Corey Johnson,Youth,youth,Renovation at Gertrude Kelly Playground,"$350,000",Renovate the basketball court and adjacent sidewalk at Gertrude Kelly Playground,"West 17th Street between 8th and 9th Avenues, NY, NY 10011",40.741666, -74.001978,,TRUE
0015,"District 03, Corey Johnson",3,Corey Johnson,Environment,environment,New Trees for Council District 3,"$100,000",Plant new trees and install tree guards on blocks with few or no trees throughout District 3.,District Wide,40.748910, -73.993683,Locations are not set so we used the District Office location,TRUE
0016,"District 05, Ben Kallos",5,Ben Kallos,Housing,housing,Lexington Houses Security Upgrade ,"$500,000","Purchase and install layered security system to ensure residents' safety in light of growing issues and incidents and the rise in neighborhood homeless population, which has caused security problems.","East Lexington Avenue between 98-99 Streets, 1538 Lexington Avenue, New York, NY 10029",40.787611, -73.950071,,TRUE
0017,"District 05, Ben Kallos",5,Ben Kallos,Youth,youth,Lexington Houses East & West Playground Renovation,"$700,000","Provide safety-compliant resurfacing and equipment for two community playgrounds, serving a large mix of resident families, with features that appeal to children from 6 months to 15 years old.","E. 98 St. between 3rd & Lex/ Lex & Park Aves.; 146 East 98th Street, New York, NY 10029",40.787000, -73.949191,only gave the coordinates for one location,TRUE
0018,"District 05, Ben Kallos",5,Ben Kallos,Parks & Recreation,parks,Parks Greening,"$1,000,000","Install new and improve existing plantings – trees, shrubs, flowers and grass -  around perimeters and entrances of John Jay Park.","John Jay Park, New York, NY 10075",40.769261, -73.949312,,TRUE
0019,"District 05, Ben Kallos",5,Ben Kallos,Education,education,STEM Green Roof for P.S./I.S. 217,"$500,000","Finalize funding to build a STEM Green Roof atop P.S. /I.S. 217. Transform 6,750 square feet of unused P.S./I.S. 217 school roof into an outdoor learning hub for science, math, nutrition and the arts.","645 Main Street, Roosevelt Island, NY 10044",40.763917, -73.948617,,TRUE
0020,"District 05, Ben Kallos",5,Ben Kallos,Education,education,Library Modernization for Eleanor Roosevelt H.S.,"$350,000","Create flexible learning space with access to computers, listening center, digital and print media, separate quiet and group spaces.  Currently cannot support number of students and technology needs.","411 East 76th Street, Ne York, NY 10021",40.770373,-73.953316,,TRUE
0021,"District 05, Ben Kallos",5,Ben Kallos,Education,education,Renovate Auditorium for Eleanor Roosevelt H.S.,"$250,000","Extend stage and replace seating and flooring to improve view, increase capacity, and support gym activities. Replace antiquated control board, install acoustical panels and simplify lighting system.","411 East 76th Street, Ne York, NY 10021",40.770273, -73.953216,,TRUE
0022,"District 05, Ben Kallos",5,Ben Kallos,Education,education,Rooftop Greenhouse at P.S. 290,"$500,000",Construction of a greenhouse as part of the green roof project at PS290. The 800sf greenhouse will provide opportunities to enhance the school's STEAM curricula & create desperately needed play space.,"311 East 82nd Street, New York, NY 10028",40.775267,-73.952917,,TRUE
0023,"District 05, Ben Kallos",5,Ben Kallos,Education,education,P.S. 290 Bathrooms,"$225,000",Replace toilets and sinks with age-appropriate fixtures and fittings. Remove unused urinals in boys bathrooms.,"311 East 82nd Street, New York, NY 10028",40.775167, -73.952817,,TRUE
0024,"District 05, Ben Kallos",5,Ben Kallos,Education,education,Computer Carts for 10 Schools,"$350,000","32 computers per cart for: P.S. 77, P.S. 198, P.S. 290, P.S./I.S. 217, M. 225, Eleanor Roosevelt, Urban Academy, Vanguard, Manhattan International, and Life Sciences, serving over 5000 students.",NYC Schools (District Wide),40.765395, -73.959740,"use the coordinates for one of the schools, Manhattan International ",TRUE
0025,"District 05, Ben Kallos",5,Ben Kallos,Education,education,HVAC for P.S.198 and P.S.77,"$350,000",Installing a split level air-conditioning system for the auditorium and cafeteria at P.S.198 and P.S.77. ,"1700 3rd Avenue (Upper East Side) New York, NY 10128",40.785148,-73.950122,,TRUE
0026,"District 05, Ben Kallos",5,Ben Kallos,Education,education,Sound System at Julia Richman JREC Auditorium,"$85,000",This project will address the acoustical needs of the auditorium and update the sound system to correct the reverberation and an inability to hear and understand speakers. ,"317 East 67th Street (Upper East Side) New York, NY 10065",40.785048, -73.950022,,TRUE
0027,"District 05, Ben Kallos",5,Ben Kallos,Seniors,seniors,Center @ Lenox Hill Neighborhood House Entrance,"$500,000","Automatic doors for the Center @ Lenox Hill Neighborhood House to enable ease of access and egress for senior center members, Robbins Plaza senior residents, visitors and staff.","343 E 70 St, between 1st and 2nd Avenues, New York, NY 10021",40.766789, -73.957125,,TRUE
0028,"District 05, Ben Kallos",5,Ben Kallos,"Arts, Culture & Community Facilities",culture,Webster Library HVAC Improvements,"$600,000",Upgrade or replacement of air-conditioning system. This library is a designated NYC cooling center. ,"1465 York Avenue (Upper East Side) New York, NY 10075",40.770678, -73.951345,,TRUE
0029,"District 05, Ben Kallos",5,Ben Kallos,"Arts, Culture & Community Facilities",culture,67th Street Library HVAC Improvements,"$600,000",Replacement or upgrade of the boiler to provide adequate heat. ,"328 East 67th Street (Upper East Side) New York, NY 10065",40.764945, -73.959553,,TRUE
0030,"District 06, Helen Rosenthal",6,Helen Rosenthal,Parks & Recreation,parks,Adult Fitness Equipment for Riverside Park,"$330,000","Installation of adult fitness equipment, including metal racks for sit-ups, pull-ups, push-ups, mats for stretching and exercise, and bars for stretching in Riverside Park.","Riverside Park, New York, NY 10025",40.801439,-73.972077,,TRUE
0031,"District 06, Helen Rosenthal",6,Helen Rosenthal,Parks & Recreation,parks,Picnic Tables for Riverside Park,"$65,000","Purchase and installation of picnic tables made of recycled, durable material capable of withstanding heavy use, weather conditions and permanently secured against theft.","Riverside Park, New York, NY 10025",40.801339, -73.971977,,TRUE
0032,"District 06, Helen Rosenthal",6,Helen Rosenthal,Parks & Recreation,parks,Restoration of Joan of Arc Plaza,"$300,000","Repairs to steps and pathways leading to and from the Joan of Arc monument, including concrete steps, resurfacing blacktop, laying cobblestone and sealing masonry around the base of the statue.","Joan of Arc Park, New York, NY 10025",40.794152, -73.976537,,TRUE
0033,"District 06, Helen Rosenthal",6,Helen Rosenthal,Parks & Recreation,parks,Restoration of Riverside Park Basketball Courts,"$200,000",Resurface and repair the existing basketball court to improve the recreation experience.,"Riverside Park at West 101st Street, New York, NY 10025",40.799575, -73.973259,,TRUE
0034,"District 06, Helen Rosenthal",6,Helen Rosenthal,Parks & Recreation,parks,Riverside Park Recreation and Activity Area,"$250,000","An activity and recreation area intended for tweens and younger adults, including facilities for a number of recreation activities.","Riverside Park at West 76th Street, New York, NY 10025",40.783313, -73.984901,,TRUE
0035,"District 06, Helen Rosenthal",6,Helen Rosenthal,Housing,housing,Playground Renovation at Wise Towers,"$350,000","Renovate the playground at Wise Towers, adding modern developmental play equipment suitable for young children and beautifying the area. (New York City Housing Authority)","124 West 91st Street, New York, NY 10024",40.789912, -73.971075,,TRUE
0036,"District 06, Helen Rosenthal",6,Helen Rosenthal,Housing,housing,Security Cameras for Amsterdam Addition,"$300,000",Installation and updates to security cameras at Amsterdam Addition. (New York City Housing Authority),"240 West 65th Street, New York, NY 10023",40.774791, -73.986988,,TRUE
0037,"District 06, Helen Rosenthal",6,Helen Rosenthal,Education,education,Creation of Library Space at P.S. 191,"$350,000",Renovate an existing lounge space to create library space to be used by students and their families at P.S. 191.,"210 West 61st Street, New York, NY 10023",40.771919, -73.987645,,TRUE
0038,"District 06, Helen Rosenthal",6,Helen Rosenthal,Education,education,Video Surveillance for P.S. 75 and M.S. 250,"$225,000",Installation of a video surveillance system to be used by the school security desk to help monitor the school's special needs population at P.S. 75 and M.S. 250.,"735 West End Avenue, New York, NY 10025",40.795272, -73.973654,,TRUE
0039,"District 06, Helen Rosenthal",6,Helen Rosenthal,Education,education,Technology Upgrades at LaGuardia High School,"$150,000","Installation of SMART Boards, laptop carts, desktop computers, and a printing system for a department at LaGuardia High School.","100 Amsterdam Avenue, New York, NY 10023",40.774115, -73.985703,,TRUE
0040,"District 06, Helen Rosenthal",6,Helen Rosenthal,Education,education,Courtyard Renovation at Brandeis Campus,"$300,000","Renovation of existing concrete courtyard, including new pavement and installation of tables, to serve the high schools located at the Brandeis Campus.","145 West 84th Street, New York, NY 10024",40.786003, -73.974033,,TRUE
0041,"District 06, Helen Rosenthal",6,Helen Rosenthal,Education,education,Auditorium Renovations and Upgrades at ​P.S. 166,"$210,000",Renovation of auditorium stage and installation of technological upgrades at the auditorium at P.S. 166.,"132 West 89th Street, New York, NY 10024",40.788896, -73.972406,,TRUE
0042,"District 06, Helen Rosenthal",6,Helen Rosenthal,Education,education,Air Conditioning at the Performing Arts Library,"$350,000",Renovation of 40-year-old air conditioning system at the New York Public Library of Performing Arts to allow visitors to access the library during the warmer months comfortably.,"40 Lincoln Center Plaza, New York, NY 10023",40.773522, -73.984573,,TRUE
0043,"District 06, Helen Rosenthal",6,Helen Rosenthal,Public Safety,safety,UWS CERT Emergency Response and Education Vehicle,"$40,000","Purchase of a vehicle for UWS Community Emergency Response Team to store emergency and educational materials, and create pop-up preparedness events at street fairs, schools, and community gatherings.”",Upper West Side,40.787289, -73.971346,Locations are not set so we used the District Office location,TRUE
0044,"District 07, Mark Levine",7,Mark Levine,"Arts, Culture & Community Facilities",culture,George Bruce Library Renovations & Repairs,"$1,000,000",Time has wounded the site and certain physical complications have developed that should be immediately addressed. The facility needs a complete overhaul of the drainage system.,"518 West 125th Street, New York, NY 10027",40.813848, -73.957045,,TRUE
0045,"District 07, Mark Levine",7,Mark Levine,"Arts, Culture & Community Facilities",culture,Save Hamilton Grange! Elevator Repair,"$400,000","Restoration to the exterior of the building and water damage within the building. Replacement of the inoperable boiler, the installation of new windows and a workable HVAC system are needed.","503 West 145th Street, New York, NY 10031",40.825686, -73.948075,,TRUE
0046,"District 07, Mark Levine",7,Mark Levine,Seniors,seniors,Riverstone Senior Center Upgrade & Renovation,"$210,000",Grounds renovation outside the entrance would be designed to budget. Priorities such as creating attractive seating areas and enclosing the dumpster would be coordinated with RA leadership.,"99 Fort Washington Avenue, New Yok, NY 10032",40.839582, -73.944607,,TRUE
0047,"District 07, Mark Levine",7,Mark Levine,Housing,housing,Lighting Upgrades for Recreational Areas,"$500,000",Inadequate lighting around playing fields. Gangs are exploiting two of the dark play areas while the inadequately lit paths are sites of frequent muggings. Proper lighting will enhance basic security.,"Manhattanville Houses  New York, NY 10031",40.819042,-73.953841,,TRUE
0048,"District 07, Mark Levine",7,Mark Levine,Housing,housing,Playground Renovation,"$500,000","Renovate, upgrade, and install new equipment and amenities.  ","Manhattanville Houses  New York, NY 10031",40.818842,-73.953641,,TRUE
0049,"District 07, Mark Levine",7,Mark Levine,Housing,housing,Audubon Houses Playground Renovation,"$500,000","Renovation of recreational area for exercise, activity and relaxation.","Audubon Houses New York, NY 10032",40.831147, -73.943016,,TRUE
0050,"District 07, Mark Levine",7,Mark Levine,Housing,housing,Basketball Court Renovations,"$500,000","Resurface, replace and install new basketball court and recreational equipment.  ","Manhattanville Houses  New York, NY 10031",40.819042,-73.953641,,TRUE
0051,"District 07, Mark Levine",7,Mark Levine,Housing,housing,Augment Exterior Security Cameras,"$500,000",Augment the current 16 cameras per building added in 2015 with additional cameras to provide full security outdoors. ,"Manhattanville Houses  New York, NY 10031",40.818942, -73.953741,,TRUE
0052,"District 07, Mark Levine",7,Mark Levine,Parks & Recreation,parks,Green Up District 7,"$300,000",Planting 100 street trees and installing tree guards.,West 125th Street to West 155th Street,40.826170, -73.946928,chose a spot within the street bracket,TRUE
0053,"District 07, Mark Levine",7,Mark Levine,Parks & Recreation,parks,Cherry Walk Safety Improvements,"$150,000",Address dangerous conditions for walkers and bikers along the 1.5 mile unbroken section of the Hudson River Greenway. Install reflective paint markings to illuminate and improve safety conditions.,West 110th Street to West 129th Street,40.810907, -73.966207,chose a spot within the street bracket,TRUE
0054,"District 07, Mark Levine",7,Mark Levine,Parks & Recreation,parks,Artificial Turf Installation,"$500,000",Install artificial turf play surface on the eastern portion of the playground in Morningside Park.,Morningside Ave. (123rd St. - 124th St.),40.810393, -73.954757,chose a spot within the street bracket,TRUE
0055,"District 07, Mark Levine",7,Mark Levine,Streets,streets,Grounds Renovation,"$325,000","Replacing sidewalks in this area will help eliminate, or reduce the amount of accidents of civilians walking, allowing for a safer travel.","Grant Houses New York, NY 10027",40.814793, -73.958416,,TRUE
0056,"District 07, Mark Levine",7,Mark Levine,Education,education,Improve Technology,"$35,000",Laptop cart for middle school students in J.H.S. 54 Booker T. Washington School.,"103 West 107th Street, New York, NY 10025",40.800637, -73.962742,,TRUE
0057,"District 07, Mark Levine",7,Mark Levine,Education,education,P.S. 28 Wright Brothers Greenhouse Project,"$250,000",Greenhouse Project Classroom Conversion with New York Sun Works will improve environmental science education in urban schools through state of the art hydroponic greenhouse science labs.,"475 West 155th Street, New York, NY 10032",40.831680, -73.942492,,TRUE
0058,"District 07, Mark Levine",7,Mark Levine,Education,education,Smart Boards,"$75,000",Installation of 5-10 smart boards at Hamilton Grange Middle School. ,"500 West 138th Street, New York, NY 10031",40.821179,-73.952956,,TRUE
0059,"District 07, Mark Levine",7,Mark Levine,Education,education,Playground Upgrades,"$400,000","Playground upgrades (secure gating, security cameras) to the basketball court to service the students in Hamilton Grange Middle School.","500 West 138th Street, New York, NY 10031",40.820979, -73.953056,,TRUE
0060,"District 07, Mark Levine",7,Mark Levine,Education,education,Technology Lab Upgrades,"$35,000",Hamilton Grange Middle School will receive either one (1) laptop cart or 10-15 desktops.,"500 West 138th Street, New York, NY 10031",40.821079, -73.953056,,TRUE
0061,"District 07, Mark Levine",7,Mark Levine,Education,education,Science Lab Upgrades ,"$75,000",Upgrade three existing science lab classrooms in Columbia Secondary School to align with NGSS standards that will enhance current STEM curriculum.,"425 West 123rd Street, New York, NY 10027",40.810846, -73.956040,,TRUE
0062,"District 07, Mark Levine",7,Mark Levine,Education,education,Indoor Hydroponic Farm,"$250,000",Indoor Hydroponic Farm to be used by 200 elementary school children attending Columbia Secondary School. There is a possibility it will be used by other local public schools too.,"425 West 123rd Street, New York, NY 10027",40.810746,-73.95614,,TRUE
0063,"District 07, Mark Levine",7,Mark Levine,Education,education,Auditorium Audio Upgrade,"$125,000","Upgrade to audio system and acoustics in the Ralph Bunche Campus auditorium which is used by three public schools, the DOE administration and the Community.","425 West 123rd Street, New York, NY 10027",40.810846,-73.95614,,TRUE
0064,"District 07, Mark Levine",7,Mark Levine,Education,education,Electrical Upgrade to CSS,"$200,000",Upgrade electricity so that electrical equipment can be used in the classrooms in the Ralph Bunche Campus. ,"425 West 123rd Street, New York, NY 10027",40.810746, -73.956040,,TRUE
0065,"District 08, Melissa Mark-Viverito",8,Melissa Mark-Viverito,Youth,youth,Mobile Robotics Lab at South Bronx Prep ,"$186,000",Adding Computer Science to our curriculum. Next Generation science standards demand students apply science & math concepts to real world needs. We wish to add mobile robotic cards to achieve this end.,"South Bronx Preparatory 360 E.145 St (Bronx) Bronx, NY 10454",40.813091,-73.920604,,TRUE
0066,"District 08, Melissa Mark-Viverito",8,Melissa Mark-Viverito,Youth,youth,Technology Upgrade to FLAGS High School,"$100,000",Technology upgrade to Foreign Language Academy of Global Studies High School (FLAGS). This will enable students to better utilize their computer lab.,"470 Jackson Avenue (Bronx - Mott Haven) Bronx, NY 10455",40.811010, -73.909309,,TRUE
0067,"District 08, Melissa Mark-Viverito",8,Melissa Mark-Viverito,Youth,youth,Bathroom Renovations: MS/HS 223,"$250,000","Essential restoration, upgrade, and efficiency enhancement of restroom facilities for our school -  M.S./H.S. 223 The Laboratory School of Finance and Technology",360 East 145th (Bronx - Mott Haven) 10454,40.813191, -73.920504,,TRUE
0068,"District 08, Melissa Mark-Viverito",8,Melissa Mark-Viverito,Youth,youth,Technology Upgrades for CPE H.S. and Heritage ,"$376,200","Technology upgrades that will impact classrooms at Park East High School, Central Park East High School and the Heritage High Schools, potentially serving approximately 1500 students daily.","East Harlem High Schools  New York, NY 10029",40.790316, -73.944108,chose the coordinates for Park East HS ,TRUE
0069,"District 08, Melissa Mark-Viverito",8,Melissa Mark-Viverito,Parks & Recreation,parks,Irrigation & Tom's Dog Run Upgrades ,"$400,000","Keep Thomas Jefferson Park green with an irrigation system to water green spaces. Tom's Dog Run is in need of water fountains, fencing and obstacles for mental stimulation and exercise for EH dogs. ","Thomas Jefferson Park (East Harlem) New York, NY 10029",40.793408, -73.935060,,TRUE
0070,"District 08, Melissa Mark-Viverito",8,Melissa Mark-Viverito,Parks & Recreation,parks,Nelson Playground Repairs,"$500,000","This project will put in a fence to separate the benches from the basketball court for the safety of those who utilize the benches. Additionally, water fountain repairs will be made to benefit all.",Nelson Playground (Bronx - Highbridge) 10452,40.834908, -73.926960,,TRUE
0071,"District 08, Melissa Mark-Viverito",8,Melissa Mark-Viverito,Parks & Recreation,parks,Bright Lights and Fancy Seating for Poor Richards,"$300,000",Poor Richards will receive new benches in addition to improved lighting to brighten up the park space. ,Poor Richards Playground (East Harlem) East 109th Street 10029,40.792679, -73.942847,,TRUE
0072,"District 08, Melissa Mark-Viverito",8,Melissa Mark-Viverito,Education,education,"Water Fountain Upgrades: CPE II, P.S.171 & P.S.108","$75,000","Water fountain upgrades for Central Park East II, P.S. 171 and P.S. 108",19 103rd Street (East Harlem) NY 10029,40.792474,-73.951527,,TRUE
0073,"District 08, Melissa Mark-Viverito",8,Melissa Mark-Viverito,Education,education,"Air Conditioning for P.S. 369X, P.S. 179X and 352X","$450,000","Providing air-conditioning to a school building that has three co-located schools - P.S. 369 Young Leaders Elementary, PS. 179 School International Cultures and X352 D75",468 East 140th St (Bronx-Mott Haven) 10454,40.809410, -73.919973,,TRUE
