Ballot ID,Full Council District,CounDist,CounPerson,Category,location_type,name,Cost,description,Location,lat,lon,Notes,shortlisted
0229,"District 31, Donovan Richards",31,Donovan Richards,Education,education,Security Cameras,"$250,000","P.S 106 is a building that's isolated from other properties, a camera surveillance system would help ensure the safety of the school community ","180 Beach 35th St., Far Rockaway",40.594656, -73.766818,,TRUE
0230,"District 31, Donovan Richards",31,Donovan Richards,Education,education,New Weight Room,"$200,000",The Far Rockaway High School weight room needs new equipment so students do not get injured; it also needs new lockers.," 821 Bay 25th St., Far Rockaway",40.602463,-73.763084,,TRUE
0231,"District 31, Donovan Richards",31,Donovan Richards,Education,education,Locker Room Renovations,"$500,000",Far Rockaway Educational Campus is made up of other schools and is in need of a better locker room. It reminds people of a dungeon. The lighting is terrible and can be dangerous  ," 821 Bay 25th St., Far Rockaway",40.602363, -73.763184,,TRUE
0232,"District 31, Donovan Richards",31,Donovan Richards,Education,education,M.S 53 Technology Upgrades ,"$250,000","Needs  new smart boards, computers and better electricity and wiring to utilize multiple devices.","10-45 Nameoke St., Far Rockaway",40.603871, -73.749697,,TRUE
0233,"District 31, Donovan Richards",31,Donovan Richards,Education,education,Gymnasium Upgrade in P.S. 183Q,"$300,000",The gymnasium is in need of basketball hoops for our kids. The gym is also in need of bleachers so the school can invite parents and the community to school activities.,"2-45 Beach 79th Street, Rockaway Beach",40.589496,-73.805884,,TRUE
0234,"District 31, Donovan Richards",31,Donovan Richards,Education,education,Auditorium Upgrade in P.S. 183Q,"$500,000","The auditorium is in need of stage curtains, a new projector screen, new speaks on stage and new fans to keep the auditorium cool.  ","2-45 Beach 79th Street, Rockaway Beach",40.589496,-73.805684,,TRUE
0235,"District 31, Donovan Richards",31,Donovan Richards,Education,education,Classroom Upgrade in P.S. 183Q,"$250,000",The classrooms are in need of electrical outlets and approximately 35 smart boards in each of the classrooms to help our students further their educations.,"2-45 Beach 79th Street, Rockaway Beach ",40.589396, -73.805784,,TRUE
0236,"District 31, Donovan Richards",31,Donovan Richards,"Arts, Culture & Community Facilities",culture,Rockaway Institute for a Sustainable Environment,"$273,732","The project with fit out RISE, new community center for local exhibits, film screenings, lectures, public events and youth programs, with furniture and equipment. ",58-03 Rockaway Beach Blvd,40.591866, -73.788103,,TRUE
0237,"District 31, Donovan Richards",31,Donovan Richards,Transit,transit, Train Countdown Clocks,"$150,000",The Rockaway train stations should  have countdown clocks so residents can know when the train and the bus coming.,District- Wide ,40.592373, -73.788468,Chose a stop on the A train ,TRUE
0238,"District 33, Stephen Levin",33,Stephen Levin,Education,education,"Sweating Should Be Fun! K293, Int’l Studies","$350,000","The gym at this campus with 4 schools, PK-12 (with 1200 mostly Title I students) needs AC!  The only large activity space in this growing school also hosts community programs and can get really hot!","284 Baltic Street, Cobble Hill",40.685391, -73.993745,,TRUE
0239,"District 33, Stephen Levin",33,Stephen Levin,Education,education,Essential STEM Labs at I.S 318 and P.S 34,"$500,000","Let's bridge the technology gap and invest in the future for 2,000+ students at two amazing but underserved schools by funding essential STEM (Science, Tech, Engineering & Math) labs at both schools!","IS 318, East Williamsburg; PS 34, Greenpoint",40.726313, -73.949739,Chose coordinates for PS 34,TRUE
0240,"District 33, Stephen Levin",33,Stephen Levin,Education,education,Make Our School Cool! M.S. 126,"$400,000",Our building serves 3 schools and 1200 kids and needs wiring for AC in the classrooms and Auditorium! It’s hard to concentrate and be good students when you’re too hot! Give them a chance to succeed!,"424 Leonard Street, Williamsburg",40.719641, -73.947982,,TRUE
0241,"District 33, Stephen Levin",33,Stephen Levin,Education,education,Finish the Upgrades with P.S. 261 Computer Carts,"$140,000",P.S. 261 is a K-5 school with 800 students. Their wiring was upgraded but to utilize the improvements the students need new computers; four new carts will give them what they need!,"314 Pacific Street, Boerum Hill",40.687250, -73.988401,,TRUE
0242,"District 33, Stephen Levin",33,Stephen Levin,Education,education,Let There Be Air! Juan Morel Campos School,"$350,000","Our school is used by D14, D75 and the community.  We need AC in our auditorium.  The auditorium gets used for many events such as performances, assemblies, and graduation and it is very hot!  ","215 Heyward Street, Williamsburg",40.704191, -73.953214,,TRUE
0243,"District 33, Stephen Levin",33,Stephen Levin,Parks & Recreation,parks,Fix Taaffe Park: Community Seating Area,"$500,000",Create a moment of peace for area residents. Support a renovated seating area where all local residents can meet under the park’s historic oak trees and plan their community’s future; together.,"390 Park Avenue, Bedford-Stuyvesant ",40.695582, -73.960712,,TRUE
0244,"District 33, Stephen Levin",33,Stephen Levin,Parks & Recreation,parks,Make Msgr. McGolrick Park Safer,"$500,000","This project focuses on repaving some of the sidewalks along the park and replacing fencing. Current sidewalks are cracked, unsafe for children, and hazardous for wheelchair and stroller access. ","Driggs Avenue, Greenpoint",40.724479, -73.943253,,TRUE
0245,"District 33, Stephen Levin",33,Stephen Levin,Parks & Recreation,parks,"Safe to Play, Green Playground at M.S. 126","$500,000",Transform a cement lot into a safe and colorful playground with interactive play structures. Additional funding through Trust for Public Land will make this a sustainable space for kids and community.,"Ericsson Playground, Greenpoint",40.720400, -73.948280,,TRUE
0246,"District 33, Stephen Levin",33,Stephen Levin,Housing,housing,NYCHA Grounds Renovations Focused on Seating,"$550,000","Gowanus & Wyckoff residents will help determine grounds improvements, to be installed at two NYCHA developments, resulting in more pleasant 
areas for enjoying time outdoors and talking with friends.","Wyckoff Gardens and Gowanus Houses, Gowanus",40.682594, -73.984562,Chose coordinates for Wyckoff Gardens ,TRUE
0247,"District 33, Stephen Levin",33,Stephen Levin,Housing,housing,Hear the Beat! Community Sound Studio,"$100,000","This project will outfit an existing computer lab as a recording studio, so youth/adults could be trained for music/audio professions. Includes upgrades to the space and all needed audio equipment.","114 Taylor St., Independence Towers, W’burg",40.705378, -73.963271,,TRUE
0248,"District 33, Stephen Levin",33,Stephen Levin,Streets,streets,Safer Crossings for Hoyt Street at Gowanus Houses,"$400,000",Make street crossings safer between this housing development and the nearby subway. Add pedestrian safety enhancements to this four-block stretch of Hoyt Street that has no existing crossings.,"Hoyt St., Butler St. to Degraw St., Gowanus",40.684419, -73.988400,,TRUE
0249,"District 33, Stephen Levin",33,Stephen Levin,Streets,streets,Street Safety Improvements near P.S.16,"$400,000",Install a curb extension at this much-used intersection between P.S. 16 and Independence Towers. Improve other street safety features between the housing development and the local school.,"Corner of Bedford Ave. and Wilson St., W’burg",40.705406, -73.962494,,TRUE
0250,"District 33, Stephen Levin",33,Stephen Levin,Streets,streets,Real Time Arrival Signage for B44 Bus Route,"$300,000","Add signage that shows real-time, updated arrival times for up to 15 bus stops along Bedford and Nostrand Avenues.",Along B44 Bus Route in District 33,40.698979, -73.956537,,TRUE
0251,"District 33, Stephen Levin",33,Stephen Levin,Streets,streets,Pedestrian Safety Improvements - Meeker Avenue,"$400,000",Continuing safety improvements along this high-speed corridor to decrease crossing distances and improve pedestrian safety.,Meeker Avenue in District 33 - Williamsburg,40.715706, -73.951678,,TRUE
0252,"District 33, Stephen Levin",33,Stephen Levin,Transit,transit,Additional Turnstiles at York St. Subway (F Train),"$250,000","Install additional turnstiles for York Street Station in 2017 which will reduce congestion and long lines for the 9,000 weekday riders now limited to only two turnstiles. ","York St. Subway Station, DUMBO",40.701401, -73.986736,,TRUE
0253,"District 34, Antonio Reynoso",34,Antonio Reynoso,Education,education,21st Century Technology at P.S. 120 and P.S. 132,"$285,000","Includes smart boards, laptops, smart tables, a 3-D Printer, a green wall, and solar & weather panels.",18 Beaver Street /320 Manhattan Avenue,40.714842, -73.945987,,TRUE
0254,"District 34, Antonio Reynoso",34,Antonio Reynoso,Education,education,Technology Upgrades at P.S. 239 and P.S. 18,"$400,000","Includes two new laptop carts, two smart tables, a 3-D printers, six smart boards, and forty-two desktops.",15-17 Weirfield Street /101 Maujer Street ,40.710827, -73.946880,,TRUE
0255,"District 34, Antonio Reynoso",34,Antonio Reynoso,Education,education,Auditorium Facelift at P.S. 147,"$400,000","Includes 300 new chairs, a new stage, and re-wiring for better sound equipment.",325 Bushwick Avenue ,40.705041, -73.938687,,TRUE
0256,"District 34, Antonio Reynoso",34,Antonio Reynoso,Education,education,A Cool Gym at P.S. 257,"$250,000","An air conditioner in the school gym, which is used throughout the school year and summer programming. ",60 Cook Street ,40.702883, -73.941793,,TRUE
0257,"District 34, Antonio Reynoso",34,Antonio Reynoso,Education,education,Visual Arts Classroom Upgrade,"$200,000","This upgrade at MS 50/El Puente Community School calls for upgrades to lighting for accurate color work, ceiling tracks to hang 3-D art work, and new floors for an all around visual arts experience. ",183 S. 3rd Street,40.711871, -73.960222,,TRUE
0258,"District 34, Antonio Reynoso",34,Antonio Reynoso,Housing,housing,Playground Upgrade at Williamsburg Houses,"$350,000","This playground will get new benches, play equipment, and a sprinkler system. ",176 Maujer Street - Block 1,40.710775, -73.942521,,TRUE
0259,"District 34, Antonio Reynoso",34,Antonio Reynoso,Housing,housing,Grounds Renovation at Bushwick Houses,"$200,000",This grounds renovation will focus on installing fence around an existing garden located behind the community center. It will be designed to budget and may include installing walkways and seating.,"50 Humboldt Street, Bushwick Houses",40.7029,-73.940563,,TRUE
0260,"District 34, Antonio Reynoso",34,Antonio Reynoso,Parks & Recreation,parks,Repaving our Bushwick Parks,"$500,000","Maria Hernandez Park and Fermi Playground can expect ground pavement, landscaping, and modern benches. ","50 Humboldt Street, Bushwick Houses",40.702800, -73.940463,,TRUE
0261,"District 34, Antonio Reynoso",34,Antonio Reynoso,"Arts, Culture & Community Facilities",culture,Electrify our Libraries in District 34 ,"$360,000","This proposal will provide four electric charging tables at each one of our libraries: Leonard Street, Bushwick Avenue and Dekalb Avenue. Residents will be able to work and re-charge from the same place.","Bushwick, Leonard, and Dekalb Libraries",40.704626, -73.939578,,TRUE
0262,"District 34, Antonio Reynoso",34,Antonio Reynoso,"Arts, Culture & Community Facilities",culture,Upgrade to Activity Rooms ,"$200,000","This proposal will upgrade the activity room in the Leonard Street Library and will include collapsible tables, folding chairs, rugs, freshly painted walls and new book bins. ",81 Devoe Street ,40.713620, -73.947886,,TRUE
0263,"District 34, Antonio Reynoso",34,Antonio Reynoso,"Arts, Culture & Community Facilities",culture,Upgrade to Activity Rooms in District 34,"$600,000","This proposal will include collapsible tables, folding chairs, rugs, freshly painted walls and new book bins for all three district libraries: Leonard Street, Bushwick Avenue and DeKalb Avenue.","Bushwick, Leonard, and Dekalb Libraries",40.691633, -73.951286,,TRUE
0264,"District 34, Antonio Reynoso",34,Antonio Reynoso,Transit,transit,Real Time Passenger Boards,"$60,000",Real Time Passenger Information in Council District 34. DOT will choose site locations with the City Council office post budget adoption.,"Ridgewood, Bushwick, and Williamsburg",40.707702, -73.950402,Locations are not set so we used the District Office location,TRUE
0265,"District 35, Laurie Cumbo",35,Laurie Cumbo,Streets,streets,President Street Bump-Outs,"$300,000","On President Street, create bump-outs to extend curbs into the street. This is a high-volume subway station with inadequate space for pedestrians. Project would decrease likelihood of injury/death.",President St. and Nostrand Ave. (2/5 Stop),40.667874, -73.950629,,TRUE
0266,"District 35, Laurie Cumbo",35,Laurie Cumbo,Streets,streets,Bus Pads on Fulton Street ,"$220,000","Bus pads replace the surface where buses stop and replace the pavement that gets warped with a solid concrete pad. The warped streets cause danger for bikes, the old and the young who walk there. ",Vanderbilt Avenue to Carlton Avenue ,40.683995, -73.968731,,TRUE
0267,"District 35, Laurie Cumbo",35,Laurie Cumbo,Streets,streets,Bump Out at Washington Avenue and Dean Street,"$300,000",Create a bump-out at the Dean Street and Washington Avenue intersection. This is in response to increased vehicular traffic on Dean Street. It will help reduce the risk of pedestrian injuries. ,Washington Avenue at Dean Street,40.679424, -73.964026,,TRUE
0268,"District 35, Laurie Cumbo",35,Laurie Cumbo,Streets,streets,Security Cameras in Precincts 88 and 77 ,"$210,000",Install Argus security cameras at intersections where NYPD precincts have identified a need. Each Argus unit is a set of 2 cameras. Three units will be allocated to each of the 2 precincts.,NYPD to Choose Place ,40.68552,-73.977817,Locations are not set so we used the District Office location,TRUE
0269,"District 35, Laurie Cumbo",35,Laurie Cumbo,Streets,streets,Security Cameras in Precincts 71 and 78 ,"$210,000",Install Argus security cameras at intersections where NYPD precincts have identified a need. Each Argus unit is a set of 2 cameras. Three units will be allocated to each of the 2 precincts.,NYPD to choose place ,40.685420, -73.977717,Locations are not set so we used the District Office location,TRUE
0270,"District 35, Laurie Cumbo",35,Laurie Cumbo,Housing,housing,Basketball Court Renovation at Lafayette Gardens,"$350,000",Renovation of basketball court. ,Lafayette Gardens Housing Development ,40.690162,-73.959918,,TRUE
0271,"District 35, Laurie Cumbo",35,Laurie Cumbo,Housing,housing,Basketball Court Renovation at Whitman Houses,"$350,000",Renovation of basketball court,Whitman Housing Development ,40.694408,-73.974404,,TRUE
0272,"District 35, Laurie Cumbo",35,Laurie Cumbo,Housing,housing,Basketball Court Renovation at Atlantic Terminal,"$350,000",Basketball court renovation ,Atlantic Terminal Housing Development ,40.682739,-73.970588,,TRUE
0273,"District 35, Laurie Cumbo",35,Laurie Cumbo,Housing,housing,Grounds Renovation,"$500,000","Project will be designed to budget in collaboration with the Resident Association leadership.  Priorities to be considered will include lighting, trees, bushes, irrigation system and metal benches",Atlantic Terminal Housing Development ,40.682839, -73.970388,,TRUE
0274,"District 35, Laurie Cumbo",35,Laurie Cumbo,Housing,housing,Safety Upgrades in Farragut Housing Development,"$500,000",Design it to budget. Install Cameras in staircases and elevators.,Farragut Housing Development,40.699112,-73.9818,,TRUE
0275,"District 35, Laurie Cumbo",35,Laurie Cumbo,Housing,housing,Renovation to Willoughby Senior Center Entrance,"$500,000","Grounds Renovation for the outside. The entry way to the Willoughby Senior Center needs new walls, new paint and new floors.",Whitman Housing Development ,40.694208,-73.974204,,TRUE
0276,"District 35, Laurie Cumbo",35,Laurie Cumbo,Housing,housing,Grounds Renovation,"$500,000","Project will be designed to budget in collaboration with the Resident Association leadership.  Priorities to be considered will include lighting, trees, bushes, irrigation system and metal benches",Lafayette Gardens Housing Development Garden,40.690062, -73.959818,,TRUE
0277,"District 35, Laurie Cumbo",35,Laurie Cumbo,Housing,housing,Grounds Renovation ,"$500,000","Project will be designed to budget in collaboration with the Resident Association leadership.  Priorities to be considered will include lighting, trees, bushes, irrigation system and metal benches",Ingersoll Housing Development Garden ,40.693815, -73.982125,,TRUE
0278,"District 35, Laurie Cumbo",35,Laurie Cumbo,Housing,housing,Renovation of Farragut Community Center Entrance,"$500,000","Renovate the entry way to the Farragut community Center needs new walls, new paint and new floors.",Farragut Housing Development ,40.699012, -73.981700,,TRUE
0279,"District 35, Laurie Cumbo",35,Laurie Cumbo,Housing,housing,HVAC System for the Willoughby Senior Center ,"$500,000",HVAC system for the Willoughby Senior Center ,Whitman Housing Development ,40.694308, -73.974304,,TRUE
0280,"District 35, Laurie Cumbo",35,Laurie Cumbo,Education,education,New Technology for High-Need Schools: PS 375 & 532,"$310,000",Creating a new computer lab at PS 375 and upgrading ancient AV technology in the auditorium at PS 532 will enable students at these two Title I schools to thrive in the 21st century.,46 McKeever Pl &1025 Eastern Pkwy ,40.664922, -73.959515,,TRUE
0281,"District 35, Laurie Cumbo",35,Laurie Cumbo,Education,education,Renovate Decrepit Bathrooms at PS 9 & PS 316,"$300,000",Update 6 badly deteriorated bathrooms; includes replacing broken toilets & installing hand dryers. ,80 Underhill Ave & 750 Classon Ave.,40.678605, -73.966266,,TRUE
0282,"District 35, Laurie Cumbo",35,Laurie Cumbo,Education,education,Learning Walls for P.S. 20,"$36,500","Install pin-able writable walls in 20 classrooms for students and teachers to actively co-create learning. 5 temporary walls already increasing learning, initiation, critical thinking and cooperation.",PS 20 The Clinton Hill School 225 Adelphi Street,40.691476, -73.971165,,TRUE
0283,"District 35, Laurie Cumbo",35,Laurie Cumbo,Transit,transit,Real-Time Information Signs: B65 & B44 Passengers,"$120 -160,000","Install real-time bus signs on two of the busiest lines in Brooklyn:

B65: Flatbush & Dean; Flatbush & Bergen; Bergen & New York; Dean & Nostrand

B44: New York & Eastern Pkwy; Nostrand & Eastern Pkwy",B65 and B44 Stops,40.681900, -73.975807,,TRUE
0284,"District 36, Robert Cornegy",36,Robert Cornegy,"Arts, Culture & Community Facilities",culture,Renovate and Upgrade Marcy Library Auditorium,"$350,000","Upgrade the multi-purpose room/ auditorium of the Marcy Branch of the Brooklyn Public Library with new electrical, lighting, flooring & shelving.",617 Dekalb Avenue ,40.691639, -73.951235,,TRUE
0285,"District 36, Robert Cornegy",36,Robert Cornegy,Housing,housing,Security Cameras for Albany Houses,"$750,000",Add new security cameras to Albany Houses. (Project will be designed to budget and may not cover fully CCTV at both Albany I and II.),Albany Houses (NYCHA),40.673301, -73.936802,,TRUE
0286,"District 36, Robert Cornegy",36,Robert Cornegy,Housing,housing,Security Cameras for Marcy Houses Senior Buildings,"$750,000","Install security camera system to cover the two senior buildings (Marcy Avenue and Stockton Place) and other parts of Marcy Houses, as feasible. (Project will be designed to budget.)",Marcy Houses (NYCHA),40.697354, -73.951142,,TRUE
0287,"District 36, Robert Cornegy",36,Robert Cornegy,Parks & Recreation,parks,A Top-Notch Dog Run for District 36,"$650,000","Transform the informal dog play area at Von King Park into a top notch dog run with separate vestibules and play areas for big and little dogs, new fencing, dog fountains and proper drainage.","Von King Park, 670 Lafayette Avenue ",40.689666, -73.946631,,TRUE
0288,"District 36, Robert Cornegy",36,Robert Cornegy,Parks & Recreation,parks,Upgrade Brower Park Basketball Courts,"$600,000","Provide beautiful new surfaces for two of the four basketball courts in Brower Park, including new drainage, pavement and lines.",Brower Park,40.673547, -73.943060,,TRUE
0289,"District 36, Robert Cornegy",36,Robert Cornegy,Parks & Recreation,parks,Upgrade Hattie Carthan Playground Handball Courts,"$400,000",Reconstruct wall (strip down to supports and re-cement); repave underfoot surface; install new benches and new fence; prune trees.,308 Monroe Street ,40.685740, -73.945288,,TRUE
0290,"District 36, Robert Cornegy",36,Robert Cornegy,Streets,streets,Pedestrian Safety at Marcy Ave. and Myrtle Ave.,"$300,000",Install neckdown at Marcy Avenue and Myrtle Avenue (In front of Marcy Houses and subway entrance).,Bedford-Stuyvesant,40.695488, -73.949372,,TRUE
0291,"District 36, Robert Cornegy",36,Robert Cornegy,Streets,streets,Goodbye to Sidewalk Cracks,"$85,000",Repair cracked sidewalks around the Armstrong NYCHA developments in D36. Quincy St b/w Marcy & Tompkins Aves.; Marcy b/w Gates to Quincy; Gates b/w Marcy and Tompkins,Armstrong I & II NYCHA Development,40.687639, -73.946699,,TRUE
0292,"District 36, Robert Cornegy",36,Robert Cornegy,Education,education,Smartboards for Smart Kids!,"$320,000","New smartboards for five D36 schools -- PS 289, PS 138, PS 93, PS 243 & Bedford Academy. $64K will fund 8 smartboards per school. Includes required electrical & data.","PS 289, PS 138, PS 93, PS 243 & Bedford Acdmy",40.674186, -73.942313,,TRUE
0293,"District 36, Robert Cornegy",36,Robert Cornegy,Education,education,New Laptops for P.S. 59,"$70,000",2 laptop carts w/ 30-35 Lenovo laptops each,211 Throop Avenue,40.697744, -73.943149,,TRUE
0294,"District 36, Robert Cornegy",36,Robert Cornegy,Education,education,4 Science Carts for Bed-Stuy New Beginnings,"$248,000","Each Science Cart = $62,000",82 Lewis Avenue ,40.694823, -73.937626,,TRUE
0295,"District 36, Robert Cornegy",36,Robert Cornegy,Education,education,Dance Studio at P.S. 3,"$200,000","Transform a classroom into a dance studio with  new floor, mirrors, barre and sound system.",50 Jefferson Avenue ,40.682347, -73.955104,,TRUE
0296,"District 38, Carlos Menchaca",38,Carlos Menchaca,Parks & Recreation,parks,Sunset Park Renovation ,"$500,000","Repaving, installation of 20 new benches, replacement of existing dilapidated chain-link fences, and adding in picnic tables.",Sunset Park,40.649112, -74.005593,,TRUE
0297,"District 38, Carlos Menchaca",38,Carlos Menchaca,Education,education,Auditorium Upgrade for M.S. 88 and M.S.136 ,"$375,000","The space is currently outdated, and needs an upgrade so it can be accessible to the community who use it the most. It is used by many groups in the community and needs to be accessible to all.","M.S.88, Sunset Park Prep, I.S.136 ",40.660470, -73.988312,,TRUE
0298,"District 38, Carlos Menchaca",38,Carlos Menchaca,Education,education,Air Conditioning Wiring,"$120,000",This project will serve P.S. 1 in Sunset Park and M.S. 88 in Windsor Terrace for the installation of wiring that will support air conditioning units throughout the schools.,309 47th Street and 544 7th Avenue,40.648723, -74.011126,,TRUE
0299,"District 38, Carlos Menchaca",38,Carlos Menchaca,Education,education,Library Update,"$450,000",The project would involve the renovation of Middle School 88 and Sunset Park High School’s Library Multimedia center. Both media centers are outdated and are in need of  technology and repair upgrade.,M.S. 88  and Sunset Park High School ,40.655534, -74.004315,,TRUE
0300,"District 38, Carlos Menchaca",38,Carlos Menchaca,Education,education,South Brooklyn Community H.S.& P.S.169 Upgrades,"$380,000","South Brooklyn High School in Red Hook of 185 students, need lockers to hold school work and belongings. P.S.169  needs renovations of bathrooms in the school because they are outdated and need to be replaced.",173 Conover St &  4305 7th Avenue ,40.677856, -74.014133,,TRUE
0301,"District 38, Carlos Menchaca",38,Carlos Menchaca,Education,education,Science Upgrade for MS.821 & IS.136,"$1,000,000","Science labs in the building are in need of an upgrade. The current rooms are outdated, and are not fully functional. ",M.S. 821 / I.S. 136 - 4004 4th Avenue,40.652231, -74.007545,,TRUE
0302,"District 38, Carlos Menchaca",38,Carlos Menchaca,Transit,transit,Community Board 6 Repair and Resurfacing,"$250,000","The streets are starting to wear out after years of improper care, the lack of care  can lead to many disasters not only for the divers, but for pedestrian as well.",Community Board 6 in Brooklyn ,40.649394,-74.009314,Locations are not set so we used the District Office location,TRUE
0303,"District 38, Carlos Menchaca",38,Carlos Menchaca,Transit,transit,"Electronic ""Locator""Sign at B70, B63,B35,B11 & B9","$600,000","Install Electronic sign on critical and conjunction bus stops to tell riders the location and arrival time of their buses for B70,B63,B35,B11, and B9. ","Sunset Park: On 4th, 5th, 8th & 9th Ave",40.647704, -74.007683,,TRUE
0304,"District 38, Carlos Menchaca",38,Carlos Menchaca,Streets,streets,Brooklyn Community Board 7 ,"$250,000","The streets are starting to wear out after years of improper care, the lack of care  can lead to many disasters not only for the divers, but for pedestrians as well.",Brooklyn Community Board 7,40.650475, -74.007603,,TRUE
