Ballot ID,Full Council District,CounDist,CounPerson,Category,location_type,name,Cost,description,Location,lat,lon,Notes,shortlisted
0074,"District 08, Melissa Mark-Viverito",8,Melissa Mark-Viverito,Education,education,Air Conditioning for PS 49X,"$250,000",Obtaining a split system will create a safer and healthier environment for the students and faculty and make the space more usable throughout the year. ,383 East 139th Street (Bronx - Mott Haven) 10454,40.810396, -73.922943,,TRUE
0075,"District 08, Melissa Mark-Viverito",8,Melissa Mark-Viverito,Education,education,Air Conditioning at P.S. 108,"$250,000",Air conditioning system for the school cafeteria at P.S. 108 Assemblyman Angelo Del Toro Educational Complex  ,1615 Madison Avenue (East Harlem) 10029,40.795393, -73.947999,,TRUE
0076,"District 08, Melissa Mark-Viverito",8,Melissa Mark-Viverito,Education,education,Air Conditioning for P.S. 65X,"$250,000 ",Install air conditioning for students and faculty to make the space more usable throughout the year.,"677 East 141st Street, Bronx",40.811371, -73.922210,,TRUE
0077,"District 08, Melissa Mark-Viverito",8,Melissa Mark-Viverito,Education,education,Electrical Upgrade for Schools,"$75,000","Electrical upgrades for classrooms in Central Park East II, P.S. 171 and P.S. 108. The upgrades will increase electrical capacity to support air conditioning units. ","Central Park East II, P.S. 171 and P.S. 108 New York, NY 10029",40.792374, -73.951427,,TRUE
0078,"District 08, Melissa Mark-Viverito",8,Melissa Mark-Viverito,Seniors,seniors,Grounds Renovation: Upgrades to Gaylord White ,"$400,000",Renovation to the outside entrance of Gaylord White Senior Houses. Project will replace the benches and tables and will level the ground. ,229 East 104th Street (East Harlem) 10029,40.789601, -73.943934,,TRUE
0079,"District 08, Melissa Mark-Viverito",8,Melissa Mark-Viverito,Seniors,seniors,Grounds Renovation: Sitting Area for Seniors ,"$400,000",Seniors in the Corsi Houses ask that the current open space be converted into a sitting area with greening and a shade structure to protect from the sun and rain. ,306 East 117th Street (East Harlem) 10029,40.796962, -73.936916,,TRUE
0080,"District 08, Melissa Mark-Viverito",8,Melissa Mark-Viverito,Seniors,seniors,Grounds Enhancement: Focus on Age Friendly Benches,"$300,000","Ground Beautification with a focus on Age Friendly benches. This will include new concrete, fencing and greening for Seniors at Washington Houses.",Washington Houses (East Harlem) 10029,40.785822,-73.949134,,TRUE
0081,"District 08, Melissa Mark-Viverito",8,Melissa Mark-Viverito,Seniors,seniors,Grounds Renovation at Metro North,"$300,000","Grounds Renovation at Metro North with a focus on Age Friendly benches. This will include new concrete, fencing and greening for seniors at Metro North Plaza.",Metro North Plaza (East Harlem) 10029,40.787275, -73.943739,,TRUE
0082,"District 08, Melissa Mark-Viverito",8,Melissa Mark-Viverito,Housing,housing,Playground Renovations at Wagner Houses ,"$500,000",Renovation to existing playground at Wagner Houses. The renovation will focus on children with special needs. ,"Wagner Houses (East Harlem) 435 East 120th Street, 10035",40.798578, -73.931495,,TRUE
0083,"District 08, Melissa Mark-Viverito",8,Melissa Mark-Viverito,Housing,housing,Renovation to Playground at Washington Houses ,"$500,000",Renovation to existing playground at Washington Houses. The renovation will focus on children with special needs. ,Washington Houses (East Harlem) 10029,40.785722, -73.949034,,TRUE
0084,"District 08, Melissa Mark-Viverito",8,Melissa Mark-Viverito,Housing,housing,Playground Renovations at Wilson Houses ,"$500,000",Renovation to existing playground at Wilson Houses ,"Wilson Houses (East Harlem) 2040 1st Avenue, 10029",40.788836, -73.939169,,TRUE
0085,"District 08, Melissa Mark-Viverito",8,Melissa Mark-Viverito,Housing,housing,Exterior Lighting at Millbrook Houses ,"$400,000",Placement of exterior lighting throughout Millbrook houses to increase visibility and safety. ,"Millbrook Houses (Bronx - Mott Haven) 160 St Ann's Avenue, 10454",40.805196, -73.918212,,TRUE
0086,"District 08, Melissa Mark-Viverito",8,Melissa Mark-Viverito,Housing,housing,Exterior Lighting at Mott Haven Houses ,"$400,000",The placement of exterior lighting throughout Mott Haven Houses will increase visibility at night and creating a safer environment.,"Mott Haven Houses (Bronx - Mott Haven) 388 East 141st Street, 10454",40.811158, -73.922101,,TRUE
0087,"District 10, Ydanis Rodriguez",10,Ydanis Rodriguez,Housing,housing,Marble Hill (Houses) Playground Upgrades,"$500,000",Safety measures desperately needed-playground is outdated and dangerous. All children deserve a safe place to play. This upgrade will increase outdoor activity and therefore has real health benefits.,"Marble Hill Houses, 5220 Broadway 10463",40.874770, -73.908883,,TRUE
0088,"District 10, Ydanis Rodriguez",10,Ydanis Rodriguez,Housing,housing,The Dyckman Houses Basketball Upgrades!,"$500,000",Build COMMUNITY through events/games. Build DREAMS and create opportunities for scholarships/viewing scouts.  Ensure deserved safety on these courts through this needed upgrade! ,"215 Nagle Avenue New York, NY 10034",40.862105,-73.923911,,TRUE
0089,"District 10, Ydanis Rodriguez",10,Ydanis Rodriguez,Housing,housing,Dyckman Houses Playground Renovation,"$350,000",Children are the future and need space to grow creatively and socially! Updating safety surfacing and structures for the playground will impact over 300 families including yours and your children!,"215 Nagle Avenue New York, NY 10034",40.862005, -73.923811,,TRUE
0090,"District 10, Ydanis Rodriguez",10,Ydanis Rodriguez,Education,education,Board of Ed. 1st Recording Studio JHS 143,"$300,000","J.H.S 143 Recording Studio would musically enrich the general and special education students, providing them with the necessary steps to establish a foundation for an influential musical career.","515 West 182nd Street New York, NY 10033",40.849382, -73.931248,,TRUE
0091,"District 10, Ydanis Rodriguez",10,Ydanis Rodriguez,Education,education,Keep it Cool A/C Installation,"$400,000",Installation of central air conditioning unit for Salome Ureña Campus auditorium and cafeteria used by over 10 low income schools and community base organization in the district. ,"4600 Broadway New York, NY 10040",40.861034, -73.930050,,TRUE
0092,"District 10, Ydanis Rodriguez",10,Ydanis Rodriguez,Education,education,Laptops for M.293,"$225,000",Laptops and carts for 600 low-income middle school and high school students in support of college and career readiness because education matters.,West 196th Street,40.860530, -73.929832,"No address found, go by coordinates I chose",TRUE
0093,"District 10, Ydanis Rodriguez",10,Ydanis Rodriguez,Education,education,Science/Media Labs for D6 STEAM Center,"$350,000","K-8 students across all District 6 will benefit from hands-on learning in science, technology, engineering and math; open weekends & evenings for the full community.",Hillside Avenue and Ellwood Street ,40.859093, -73.927596,"No address found, go by coordinates I chose",TRUE
0094,"District 10, Ydanis Rodriguez",10,Ydanis Rodriguez,Parks & Recreation,parks,Get Fit For Free ,"$250,000","Free outdoor fitness equipment: pull up and dip bars, benches, and more; because health and fitness for our youth and people of all ages and abilities in a safe environment matters. ADA accessible.",W.173 St. Btw Haven Ave. & Ft.Washington Ave.,40.845889, -73.941687,"No address found, go by coordinates I chose",TRUE
0095,"District 10, Ydanis Rodriguez",10,Ydanis Rodriguez,Parks & Recreation,parks,Repair & Fitness Area: Sunken Playground,"$485,000","Tons of kids and families use this park, but ""the Pit"" needs some major TLC. Vote to transform the playground--add exercise equipment, repaint basketball courts, repair the stairs and more!",West 167th Street and Edgecombe Avenue ,40.838127, -73.936210,"No address found, go by coordinates I chose",TRUE
0096,"District 10, Ydanis Rodriguez",10,Ydanis Rodriguez,Streets,streets,Bus Pads,"$320,000",Flexible concrete under paved road to ensure the quality and safety of bus stops for both passengers and buses. ,DOT Determines,40.847824,-73.937786,Locations are not set so we used the District Office location,TRUE
0097,"District 10, Ydanis Rodriguez",10,Ydanis Rodriguez,Streets,streets,Real Time Passenger Information,"$200,000",Bus countdown clocks with live timing of bus arrivals district-wide. Would allow for better time-management for people without access to technology.,DOT Determines,40.847724, -73.937686,Locations are not set so we used the District Office location,TRUE
0098,"District 10, Ydanis Rodriguez",10,Ydanis Rodriguez,Youth,youth,WHEELS/ I.S.143 Athletic Facilities Upgrade,"$400,000","The WHEELS/I.S143 building hosts athletic teams, programs & events. Facilities are substandard lacking bleachers, fitness center & locker rooms despite more than 15 teams and programs using the facility.","511 West 182nd Street, New York, NY 10033",40.848874, -73.930986,,TRUE
0099,"District 10, Ydanis Rodriguez",10,Ydanis Rodriguez,Youth,youth,P.S 152/M.178 Playground Upgrade,"$500,000",Kids have many accidents at this unsafe playground. Safe new ground padding and 2 new play structures would serve both schools and children in the neighborhood currently without a nearby playground.,"93 Nagle Avenue, #121, New York, NY 10040",40.860441, -73.927728,,TRUE
0100,"District 11, Andy Cohen",11,Andy Cohen,Parks & Recreation,parks,Wakefield Playground/Basketball Court Renovations,"$300,000","Renovation to basketball courts, part of only recreational space in community.",Carpenter Ave. Btw E. 239 St. & E. 240 St.,40.901914, -73.855079,"No address found, go by coordinates I chose",TRUE
0101,"District 11, Andy Cohen",11,Andy Cohen,Parks & Recreation,parks,Woodlawn Playground Spray Shower Renovations,"$300,000",Update cement spray shower to make it usable for local children,Van Cortlandt Park East & Kepler Ave.,40.900091, -73.871488,"No address found, go by coordinates I chose",TRUE
0102,"District 11, Andy Cohen",11,Andy Cohen,Parks & Recreation,parks,Hackett Park Dog Run Improvements,"$500,000",Upgrade fencing & installation of features within dog run.,Riverdale Ave. & W. 254th Street,40.901476, -73.905756,"No address found, go by coordinates I chose",TRUE
0103,"District 11, Andy Cohen",11,Andy Cohen,Parks & Recreation,parks,Adult Fitness Equipment at Classic Playground,"$400,000",Install fitness equipment for adults for recreational use.,Van Cortlandt Park S.,40.885271, -73.890294,"No address found, go by coordinates I chose",TRUE
0104,"District 11, Andy Cohen",11,Andy Cohen,Parks & Recreation,parks,Seton Park Mini Skate Park,"$450,000",Construction of mini skate park for teenagers & young adults to skate in safe place.,Independence Ave. & W. 235th St (SW of Park),40.886298, -73.914170,"No address found, go by coordinates I chose",TRUE
0105,"District 11, Andy Cohen",11,Andy Cohen,Transit,transit,Bus Countdown Clocks,"$100,000",Commuters often wait long lengths of time without knowing when the next bus will arrive.  The installation of bus countdown clocks will alert commuters how far away the next buses are.,"Within District 11 (Bx1, Bx10, Bx16, Bx31)",40.886951, -73.912457,Chose a spot along bus route ,TRUE
0106,"District 11, Andy Cohen",11,Andy Cohen,Education,education,In-Tech Academy Gym Lockers,"$400,000",To replace the old gym lockers at In-Tech Academy,"2975 Tibbet Ave. Bronx, NY 10463",40.879073, -73.910999,,TRUE
0107,"District 11, Andy Cohen",11,Andy Cohen,Education,education,District 11 Schools Technology Upgrade,"$300,000","To provide a technology upgrade for students in the district.  $50,000 per school.  Includes Laptop carts, smart boards, In-Tech news network program.","PS 94, 340, 16, & 19, In-Tech Academy, & ISL",40.880497, -73.875090,Chose the coordinates for PS 94,TRUE
0108,"District 11, Andy Cohen",11,Andy Cohen,Education,education,P.S. 280/M.S. 80 Auditorium Renovations,"$275,000",Replacement of outdated seating in the auditorium. Events and community meetings are held in the auditorium throughout the year.,149 East Mosholu Parkway North,40.876818, -73.881204,,TRUE
0109,"District 11, Andy Cohen",11,Andy Cohen,"Arts, Culture & Community Facilities",culture,Mosholu Library HVAC & Roof,"$400,000","Installation of HVAC system, including unit on roof & compressor, air handling units and ejector pump.","285 E. 205th Street Bronx, NY 10467",40.874389, -73.878185,,TRUE
0110,"District 11, Andy Cohen",11,Andy Cohen,"Arts, Culture & Community Facilities",culture,Spuyten Duyvil Library HVAC System,"$400,000","Installation of HVAC system, including unit on roof & compressor, air handling units and ejector pump.","650 West 235th Street, Bronx, NY 10463",40.886558, -73.914686,,TRUE
0111,"District 11, Andy Cohen",11,Andy Cohen,Streets,streets,District 11 Security Cameras,"$300,000","Security Cameras for the 50th, 47th and 52nd Precincts within District 11.",District- Wide ,40.880469, -73.907029,Locations are not set so we used the District Office location,TRUE
0112,"District 15, Ritchie Torres",15,Ritchie Torres,Transit,transit,Bus Countdown Clocks,"$40,000",Two bus countdown clocks which will help riders know when the next bus will be arriving.,Transportation Hubs ,40.859141,-73.885665,Locations are not set so we used the District Office location,TRUE
0113,"District 15, Ritchie Torres",15,Ritchie Torres,Parks & Recreation,parks,Bronx Park East Physical Exercise Equipment,"$400,000",Construct physical exercise equipment in Bronx Park.,Between Waring Avenue and Rosewood Street,40.862502, -73.870512,chose a spot within the street bracket,TRUE
0114,"District 15, Ritchie Torres",15,Ritchie Torres,Parks & Recreation,parks,Zimmerman Playground Basketball Court,"$500,000",Resurface basketball court in Zimmerman Playground.,Zimmerman Playground,40.866162, -73.868737,,TRUE
0115,"District 15, Ritchie Torres",15,Ritchie Torres,Streets,streets,NYPD Security Cameras,"$350,000",Install ten NYPD Security Cameras throughout District 15.,TBD,40.859041, -73.885565,Locations are not set so we used the District Office location,TRUE
0116,"District 15, Ritchie Torres",15,Ritchie Torres,Education,education,Jonas Brock Academy Science Cart,"$62,000",Purchase a mobile science cart with lab materials for the students of Jonas Bronck Academy. ,"400 East Fordham Road, Bronx, NY 10458",40.861311, -73.891229,,TRUE
0117,"District 15, Ritchie Torres",15,Ritchie Torres,Education,education,Mobile Laptop Carts and Smart Boards ,"$305,000","Purchase seven carts with thirty laptops each, and ten interactive white boards to be used by students.","M.S.391, P.S.9, I.S.254, Jonas Bronck Academy",40.856708, -73.898770,Chose the coordinates for PS 9,TRUE
0118,"District 15, Ritchie Torres",15,Ritchie Torres,Education,education,Jungle Gym at P.S.54,"$150,000",Construct a jungle gym in the yard of P.S. 54.,"2703 Webster Avenue, Bronx, NY 10458",40.864934, -73.887770,,TRUE
0119,"District 15, Ritchie Torres",15,Ritchie Torres,Education,education,P.S. 23 Playground Renovation,"$400,000","Renovate the playground of P.S. 23, including a new jungle gym.","2151 Washington Avenue, Bronx, NY 10457",40.853377, -73.894697,,TRUE
0120,"District 15, Ritchie Torres",15,Ritchie Torres,Education,education,TAPCO Lockers,"$200,000",Install 80 lockers to create a girl's locker room for Theater Arts Production Company School. There are currently no lockers for female students.,"2225 Webster Avenue, Bronx, NY 10457",40.854661, -73.896998,,TRUE
0121,"District 15, Ritchie Torres",15,Ritchie Torres,Housing,housing,Murphy Houses Grounds Renovation,"$300,000",Renovate benches and resurface concrete in Murphy Houses.,NYCHA Murphy Houses,40.842566, -73.893841,,TRUE
0122,"District 19, Paul Vallone",19,Paul Vallone,Parks & Recreation,parks,Basketball Court and Sidewalk Renovation,"$500,000","Project would renovate the Bay Terrace Playground basketball court, including repaving and rim/backboard replacement. Sidewalk adjacent to the basketball court would be also be reconstructed. ",Bay Terrace Playground (Bay Terrace) 11360,40.782311, -73.777620,,TRUE
0123,"District 19, Paul Vallone",19,Paul Vallone,Parks & Recreation,parks,Pedestrian Safety Sidewalk and Guardrail,"$550,000",Project would create concrete pedestrian sidewalk along the Northbound Whitestone Expy. Service Road between 20th Ave. and 14th Ave. Guardrail would be installed along sidewalk for pedestrian safety. ,Harvey Park (Whitestone/College Point) 11357,40.783219, -73.822966,,TRUE
0124,"District 19, Paul Vallone",19,Paul Vallone,Parks & Recreation,parks,Adult Fitness Center at Little Bay Park ,"$250,000",Project would install adult fitness equipment within Little Bay Park to promote good health and appeal to people of all fitness levels. Fitness equipment would be accessible to the public.,Little Bay Park (Bayside/Whitestone) 11360 ,40.789999, -73.788762,,TRUE
0125,"District 19, Paul Vallone",19,Paul Vallone,Parks & Recreation,parks,Adult Fitness Center at MacNeil Park,"$250,000",Project would install adult fitness equipment within Little Bay Park to promote good health and appeal to people of all fitness levels. Fitness equipment would be accessible to the public.,MacNeil Park (College Point) 11356,40.792892,-73.852203,,TRUE
0126,"District 19, Paul Vallone",19,Paul Vallone,Parks & Recreation,parks,Basketball Court Renovation at MacNeil Park,"$650,000","Project would renovate the MacNeil Park basketball court, including repaving and rim/backboard replacement. This project would also create an additional half-court for the park.",MacNeil Park (College Point) 11356,40.792792, -73.852103,,TRUE
0127,"District 19, Paul Vallone",19,Paul Vallone,Parks & Recreation,parks,Basketball Court Renovation at Marie Curie Park,"$350,000","Project would renovate the Marie Curie Park basketball court, including repaving and rim/backboard replacement. ",Marie Curie Park (Bayside) 11361,40.757076, -73.771525,,TRUE
0128,"District 19, Paul Vallone",19,Paul Vallone,Transit,transit,Real Time Passenger Countdown Clocks,"$160,000","Project would install countdown clocks to certain bus stops along the Q12 and Q13 bus routes. The countdown is not by time, but rather by how many stops away the next bus is.",Q12 and Q13 Bus Routes,40.760348, -73.768181,Chose a stop on the Q13 ,TRUE
0129,"District 19, Paul Vallone",19,Paul Vallone,Streets,streets,NYPD Security Cameras,"$105,000","Project would fund three NYPD security cameras in District 19. These security cameras would enhance crime prevention, provide a sense of security and establish surveillance in remote areas.  ",District 19 (At NYPD discretion),40.761539, -73.770225,Locations are not set so we used the District Office location,TRUE
0130,"District 19, Paul Vallone",19,Paul Vallone,Education,education,P.S. 98 Technology Upgrade,"$70,000",Project would allow P.S. 98 to acquire laptops for school community and student use. This upgrade will help enhance instruction and allow students greater learning opportunities.,32-20 235th Street (Douglaston),40.769108, -73.749456,,TRUE
0131,"District 19, Paul Vallone",19,Paul Vallone,Education,education,P.S. 159 Technology Upgrade,"$105,000",Project would allow P.S. 159 to acquire laptops for school community and student use. This upgrade will help enhance instruction and allow students greater learning opportunities.,205-01 33rd Avenue (Bayside),40.770089, -73.783906,,TRUE
0132,"District 19, Paul Vallone",19,Paul Vallone,Education,education,P.S. 21 Playground Renovation,"$400,000","Project would renovate the P.S. 21 playground for the use of the school community. This renovation would include replacement of play equipment, safety surfaces and asphalt surfaces.",147-36 26th Avenue (Flushing/College Point),40.774142, -73.818518,,TRUE
0133,"District 19, Paul Vallone",19,Paul Vallone,Education,education,J.H.S. 194 Auditorium Upgrade,"$550,000","Project would replace lighting, curtains, sound system, flooring, A/V system and auditorium seating. The auditorium is used for both school and community events.",154-60 17th Avenue (Whitestone),40.783167, -73.806866,,TRUE
0134,"District 19, Paul Vallone",19,Paul Vallone,Education,education,P.S. 79 Gymnasium Upgrade,"$200,000","Project would renovate the school recreational space by replacing wall padding, basketball hoop backboards, sound system, scoreboard and additional gymnasium equipment.",147-27 15th Drive (Whitestone),40.785971, -73.817204,,TRUE
0135,"District 19, Paul Vallone",19,Paul Vallone,Education,education,Adrien Block Campus Cafeteria Upgrade,"$400,000","Project would upgrade the multi-use cafeteria shared by three schools: IS 25, World Journalism Prep School & P233. Upgrade includes new flooring, furniture, paint, sound system & food service/display.",34-65 192nd Street (Flushing),40.764960, -73.789591,,TRUE
0136,"District 19, Paul Vallone",19,Paul Vallone,Education,education,P.S. 193 Auditorium Upgrade,"$500,000","Project would replace lighting, curtains, sound system, flooring, A/V system and auditorium seating. The auditorium is used for both school and community events.",152-20 11th Avenue (Whitestone),40.792112, -73.809486,,TRUE
0137,"District 19, Paul Vallone",19,Paul Vallone,Education,education,Bayside High School Music Educational Complex,"$450,000","Project will fund phase three of state-of-the-art music studio for Bayside High School, which has 350 students in their ""Career and Technical Education"" music production and performance program. ",32-24 Corporal Kennedy Street (Bayside),40.771454, -73.780685,,TRUE
0138,"District 19, Paul Vallone",19,Paul Vallone,"Arts, Culture & Community Facilities",culture,Wall Shelf at Douglaston/Little Neck Library,"$50,000",Project would install a wall shelf with multiple outlets and chairs for laptop/tablet users for greater efficiency and safety in computer areas of the library.,249-01 Northern Blvd (Douglaston/Little Neck),40.768226, -73.738195,,TRUE
0139,"District 21, Julissa Ferreras-Copeland",21,Julissa Ferreras-Copeland,Parks & Recreation,parks,Bathroom Upgrade at Josephine Caminiti Playground,"$500,000","This proposal is for 1/3 of the cost of new stalls, updated plumbing, improved signage for comfort station/restroom.","102nd Street and Alstyne Avenue, Corona",40.743686,-73.861937,,TRUE
0140,"District 21, Julissa Ferreras-Copeland",21,Julissa Ferreras-Copeland,Parks & Recreation,parks,Newly Paved Walkways Josephine Caminiti Playground,"$300,000",Newly paved walkways through the park and playing areas. ,"102nd Street and Alstyne Avenue, Corona",40.743586, -73.861837,,TRUE
0141,"District 21, Julissa Ferreras-Copeland",21,Julissa Ferreras-Copeland,Parks & Recreation,parks,Park of the Americas Bathroom Improvements ,"$500,000","This proposal is for 1/3 of the cost of new stalls, updated plumbing, improved signage for comfort station/restroom.","104th Street and 42nd Avenue, Corona",40.748747,-73.861714,,TRUE
0142,"District 21, Julissa Ferreras-Copeland",21,Julissa Ferreras-Copeland,Parks & Recreation,parks,Bathroom Improvements at East Elmhurst Park,"$500,000","This proposal is for 1/3 of the cost of new stalls, updated plumbing, improved signage for comfort station/restroom.","100th Street and 25th Avenue, East Elmhurst",40.765644,-73.870596,,TRUE
0143,"District 21, Julissa Ferreras-Copeland",21,Julissa Ferreras-Copeland,Parks & Recreation,parks,Improved Lighting at East Elmhurst Playground,"$200,000",East Elmhurst playground lighting upgrade will allow for a safe playing experience during the early evening hours for families.,"100th Street and 25th Avenue, East Elmhurst",40.765544, -73.870496,,TRUE
0144,"District 21, Julissa Ferreras-Copeland",21,Julissa Ferreras-Copeland,Parks & Recreation,parks,Brand New Pathways at Park of the Americas,"$300,000",Newly paved walkways and playing areas through the Park of the Americas. ,"104th Street and 42nd Avenue, Corona",40.748647, -73.861614,,TRUE
0145,"District 21, Julissa Ferreras-Copeland",21,Julissa Ferreras-Copeland,"Arts, Culture & Community Facilities",culture,Technology Upgrade at the Corona Library ,"$35,000",New tablets and computers for members of the Corona Library. Tablets will be available to rent for members with library cards.,"38-23 104th Street, Corona",40.750922, -73.861967,,TRUE
0146,"District 21, Julissa Ferreras-Copeland",21,Julissa Ferreras-Copeland,"Arts, Culture & Community Facilities",culture,New Computers & Tablets at the LeFrak City Library,"$35,000",New tablets and computers for members of the LeFrak City Library. Tablets will be available to rent for members.,"98-30 57th Avenue, Corona",40.737460, -73.861585,,TRUE
0147,"District 21, Julissa Ferreras-Copeland",21,Julissa Ferreras-Copeland,Education,education,New Smartboards for P.S. 14Q,"$80,000","P.S. 14Q will have new smart boards to teach on, expanding the way to educate local students. Local students will learn via interactive lessons on the smart boards. ",107-01 Otis Avenue,40.740884, -73.854383,,TRUE
0148,"District 21, Julissa Ferreras-Copeland",21,Julissa Ferreras-Copeland,Education,education,New Laptops for P.S. 16Q  Students,"$80,000","P.S. 16Q will have new laptops for students to use, expanding the way to educate local students. Local students will learn via interactive lessons on the laptops. "," 41-15 104th Street, Corona",40.749095, -73.860560,,TRUE
0149,"District 22, Costa Constantinides",22,Costa Constantinides,Education,education,New Computer Lab,"$80,000",Build a new computer lab in an unused classroom,"IS 141, 37-11 21st Ave., Astoria",40.775828, -73.904694,,TRUE
